### ISSUE TITLE
WDS does not appear to work.

### ISSUE THREAD

**Issue by onslauth** [kaloz/mwlwifi#32]
Hi,

I have purchased two Linksys WRT1900AC devices, and would like to connect them together using WDS.

I have installed the latest version of the OpenWRT firmware on both devices:
```
root@Chaos-ni:/etc# cat openwrt_release 
DISTRIB_ID='OpenWrt'
DISTRIB_RELEASE='15.05-rc3'
DISTRIB_REVISION='r46163'
DISTRIB_CODENAME='chaos_calmer'
DISTRIB_TARGET='mvebu/generic'
DISTRIB_DESCRIPTION='OpenWrt Chaos Calmer 15.05-rc3'
DISTRIB_TAINTS=''
root@Chaos-ni:/etc#
```

```
root@Chaos-ni:~# cat /etc/openwrt_release 
DISTRIB_ID='OpenWrt'
DISTRIB_RELEASE='15.05-rc3'
DISTRIB_REVISION='r46163'
DISTRIB_CODENAME='chaos_calmer'
DISTRIB_TARGET='mvebu/generic'
DISTRIB_DESCRIPTION='OpenWrt Chaos Calmer 15.05-rc3'
DISTRIB_TAINTS=''
root@Chaos-ni:~# 
```

I have configured the devices as follows
#### Network config
```
root@Chaos-ichi:~# cat /etc/config/network 

config interface 'loopback'
	option ifname 'lo'
	option proto 'static'
	option ipaddr '127.0.0.1'
	option netmask '255.0.0.0'

config globals 'globals'
	option ula_prefix 'fd17:4a8c:691d::/48'

config interface 'lan'
	option force_link '1'
	option type 'bridge'
	option proto 'static'
	option ip6assign '60'
	option ipaddr '10.0.1.1'
	option netmask '255.0.0.0'
	option delegate '0'
	option _orig_ifname 'eth0'
	option _orig_bridge 'true'
	option ifname 'eth0'
	option gateway '10.6.6.6'
	option dns '8.8.8.8'
	option stp '1'

config switch
	option name 'switch0'
	option reset '1'
	option enable_vlan '1'

config switch_vlan
	option device 'switch0'
	option vlan '1'
	option ports '0 1 2 3 5'

config switch_vlan
	option device 'switch0'
	option vlan '2'
	option ports '4 6'

root@Chaos-ichi:~#
```

#### Wireless config
```
root@Chaos-ichi:~# cat /etc/config/wireless 

config wifi-device 'radio0'
	option type 'mac80211'
	option channel '11'
	option hwmode '11g'
	option path 'soc/soc:pcie-controller/pci0000:00/0000:00:02.0/0000:02:00.0'
	option htmode 'HT20'
	option country 'DE'
	option disabled '0'
	option txpower '20'

config wifi-device 'radio1'
	option type 'mac80211'
	option channel '36'
	option hwmode '11a'
	option path 'soc/soc:pcie-controller/pci0000:00/0000:00:03.0/0000:03:00.0'
	option htmode 'VHT80'
	option country 'DE'
	option disabled '1'
	option txpower '20'

config wifi-iface
	option device 'radio0'
	option network 'lan'
	option ssid 'Chaos'
	option mode 'ap'
	option key 'secret'
	option wds '1'
	option encryption 'psk2'
#	option wmm '0'

root@Chaos-ichi:~# 
```

#### Output from ifconfig
```
root@Chaos-ichi:~# ifconfig
br-lan    Link encap:Ethernet  HWaddr C0:56:27:5F:8A:85  
          inet addr:10.0.1.1  Bcast:10.255.255.255  Mask:255.0.0.0
          inet6 addr: fd17:4a8c:691d::1/60 Scope:Global
          inet6 addr: fe80::c256:27ff:fe5f:8a85/64 Scope:Link
          UP BROADCAST RUNNING MULTICAST  MTU:1500  Metric:1
          RX packets:353263 errors:0 dropped:0 overruns:0 frame:0
          TX packets:1575 errors:0 dropped:0 overruns:0 carrier:0
          collisions:0 txqueuelen:0 
          RX bytes:44908408 (42.8 MiB)  TX bytes:155832 (152.1 KiB)

eth0      Link encap:Ethernet  HWaddr C0:56:27:5F:8A:85  
          UP BROADCAST RUNNING MULTICAST  MTU:1500  Metric:1
          RX packets:315338 errors:0 dropped:0 overruns:0 frame:0
          TX packets:40902 errors:0 dropped:0 overruns:0 carrier:0
          collisions:0 txqueuelen:532 
          RX bytes:45572174 (43.4 MiB)  TX bytes:4543308 (4.3 MiB)
          Interrupt:26 

lo        Link encap:Local Loopback  
          inet addr:127.0.0.1  Mask:255.0.0.0
          inet6 addr: ::1/128 Scope:Host
          UP LOOPBACK RUNNING  MTU:65536  Metric:1
          RX packets:737 errors:0 dropped:0 overruns:0 frame:0
          TX packets:737 errors:0 dropped:0 overruns:0 carrier:0
          collisions:0 txqueuelen:0 
          RX bytes:82544 (80.6 KiB)  TX bytes:82544 (80.6 KiB)

wlan0     Link encap:Ethernet  HWaddr 00:25:9C:13:A2:80  
          inet6 addr: fe80::225:9cff:fe13:a280/64 Scope:Link
          UP BROADCAST RUNNING MULTICAST  MTU:1500  Metric:1
          RX packets:38343 errors:0 dropped:0 overruns:0 frame:0
          TX packets:314811 errors:0 dropped:0 overruns:0 carrier:0
          collisions:0 txqueuelen:1000 
          RX bytes:4332781 (4.1 MiB)  TX bytes:51748917 (49.3 MiB)

wlan0.sta1 Link encap:Ethernet  HWaddr 00:25:9C:13:A2:80  
          inet6 addr: fe80::225:9cff:fe13:a280/64 Scope:Link
          UP BROADCAST RUNNING MULTICAST  MTU:1500  Metric:1
          RX packets:1251 errors:0 dropped:0 overruns:0 frame:0
          TX packets:1418 errors:0 dropped:0 overruns:0 carrier:0
          collisions:0 txqueuelen:1000 
          RX bytes:71331 (69.6 KiB)  TX bytes:96011 (93.7 KiB)

root@Chaos-ichi:~# 
```

#### Output from 'iwinfo wlan0 assoclist'
```
root@Chaos-ichi:~# iwinfo wlan0 assoclist
00:25:9C:13:B3:FF  -27 dBm / -95 dBm (SNR 68)  200 ms ago
	RX: 195.0 MBit/s, MCS 23, 20MHz                39625 Pkts.
	TX: 195.0 MBit/s, MCS 23, 20MHz               356484 Pkts.

root@Chaos-ichi:~# 
```

#### Output from 'brctl show'
```
root@Chaos-ichi:~# brctl show
bridge name	bridge id		STP enabled	interfaces
br-lan		7fff.c056275f8a85	yes		eth0
							wlan0
							wlan0.sta1
root@Chaos-ichi:~# 
```

#### Driver
```
root@Chaos-ichi:~# readlink /sys/class/net/wlan0/device/driver
../../../../../../bus/pci/drivers/mwlwifi
root@Chaos-ichi:~# 
```

#### Network config
```
root@Chaos-ni:~# cat /etc/config/network 

config interface 'loopback'
	option ifname 'lo'
	option proto 'static'
	option ipaddr '127.0.0.1'
	option netmask '255.0.0.0'

config globals 'globals'
	option ula_prefix 'fd33:56b0:57c7::/48'

config interface 'lan'
	option force_link '1'
	option type 'bridge'
	option proto 'static'
	option ip6assign '60'
	option delegate '0'
	option _orig_ifname 'eth0'
	option _orig_bridge 'true'
	option ipaddr '10.0.1.2'
	option netmask '255.0.0.0'
	option gateway '10.6.6.6'
	option dns '8.8.8.8'
	option stp '1'
	option ifname 'eth0'

config switch
	option name 'switch0'
	option reset '1'
	option enable_vlan '1'

config switch_vlan
	option device 'switch0'
	option vlan '1'
	option ports '0 1 2 3 5'
	option vid '1'

root@Chaos-ni:~# 
```

#### Wireless config
```
root@Chaos-ni:~# cat /etc/config/wireless 

config wifi-device 'radio0'
	option type 'mac80211'
	option channel '11'
	option hwmode '11g'
	option path 'soc/soc:pcie-controller/pci0000:00/0000:00:02.0/0000:02:00.0'
	option htmode 'HT20'
	option country 'DE'
	option disabled '0'
	option txpower '20'

config wifi-device 'radio1'
	option type 'mac80211'
	option channel '36'
	option hwmode '11a'
	option path 'soc/soc:pcie-controller/pci0000:00/0000:00:03.0/0000:03:00.0'
	option htmode 'VHT80'
	option disabled '1'
	option country 'DE'

config wifi-iface
	option device 'radio0'
	option network 'lan'
	option ssid 'Chaos'
	option mode 'sta'
	option bssid '00:25:9C:13:A2:80'
	option key 'secret'
	option wds '1'
	option encryption 'psk2'

root@Chaos-ni:~#
```

#### Output from ifconfig
```
root@Chaos-ni:~# ifconfig
br-lan    Link encap:Ethernet  HWaddr C0:56:27:5F:8A:3D  
          inet addr:10.0.1.2  Bcast:10.255.255.255  Mask:255.0.0.0
          inet6 addr: fe80::c256:27ff:fe5f:8a3d/64 Scope:Link
          inet6 addr: fd33:56b0:57c7::1/60 Scope:Global
          UP BROADCAST RUNNING MULTICAST  MTU:1500  Metric:1
          RX packets:635819 errors:0 dropped:0 overruns:0 frame:0
          TX packets:1204 errors:0 dropped:0 overruns:0 carrier:0
          collisions:0 txqueuelen:0 
          RX bytes:81824035 (78.0 MiB)  TX bytes:115410 (112.7 KiB)

eth0      Link encap:Ethernet  HWaddr C0:56:27:5F:8A:3D  
          UP BROADCAST RUNNING MULTICAST  MTU:1500  Metric:1
          RX packets:46123 errors:0 dropped:0 overruns:0 frame:0
          TX packets:593458 errors:0 dropped:0 overruns:0 carrier:0
          collisions:0 txqueuelen:532 
          RX bytes:5149311 (4.9 MiB)  TX bytes:85888335 (81.9 MiB)
          Interrupt:26 

lo        Link encap:Local Loopback  
          inet addr:127.0.0.1  Mask:255.0.0.0
          inet6 addr: ::1/128 Scope:Host
          UP LOOPBACK RUNNING  MTU:65536  Metric:1
          RX packets:11 errors:0 dropped:0 overruns:0 frame:0
          TX packets:11 errors:0 dropped:0 overruns:0 carrier:0
          collisions:0 txqueuelen:0 
          RX bytes:1584 (1.5 KiB)  TX bytes:1584 (1.5 KiB)

wlan0     Link encap:Ethernet  HWaddr 00:25:9C:13:B3:FF  
          inet6 addr: fe80::225:9cff:fe13:b3ff/64 Scope:Link
          UP BROADCAST RUNNING MULTICAST  MTU:1500  Metric:1
          RX packets:591165 errors:0 dropped:0 overruns:0 frame:0
          TX packets:44904 errors:0 dropped:0 overruns:0 carrier:0
          collisions:0 txqueuelen:1000 
          RX bytes:85718845 (81.7 MiB)  TX bytes:5877320 (5.6 MiB)

root@Chaos-ni:~# 
```

#### Output from 'iwinfo wlan0 assoclist'
```
root@Chaos-ni:~# iwinfo wlan0 assoclist
00:25:9C:13:A2:80  -22 dBm / -84 dBm (SNR 62)  140 ms ago
	RX: 195.0 MBit/s, MCS 23, 20MHz               594619 Pkts.
	TX: 195.0 MBit/s, MCS 23, 20MHz                39725 Pkts.

root@Chaos-ni:~# 
```

#### Output from 'brctl show'
```
root@Chaos-ni:~# brctl show
bridge name	bridge id		STP enabled	interfaces
br-lan		7fff.c056275f8a3d	yes		eth0
							wlan0
root@Chaos-ni:~#
```

#### Driver
```
root@Chaos-ni:~# readlink /sys/class/net/wlan0/device/driver
../../../../../../bus/pci/drivers/mwlwifi
root@Chaos-ni:~# uname -a
```

## Basic diagnosis

The problem seems to be that the ARP requests are not being answered by the client side, as can be seen when sniffing on the wlan0 interfaces while trying to ping from the AP to the Client.

### AP side
```
23:10:17.153613 ARP, Request who-has 10.0.1.2 tell 10.0.1.1, length 28
23:10:17.645145 ARP, Request who-has 169.254.251.46 tell 10.0.6.66, length 46
23:10:18.153512 ARP, Request who-has 10.0.1.2 tell 10.0.1.1, length 28
23:10:18.321562 ARP, Request who-has 169.254.251.46 tell 10.0.6.66, length 46
23:10:19.153513 ARP, Request who-has 10.0.1.2 tell 10.0.1.1, length 28
23:10:19.321603 ARP, Request who-has 169.254.251.46 tell 10.0.6.66, length 46
23:10:20.155524 ARP, Request who-has 10.0.1.2 tell 10.0.1.1, length 28
23:10:21.153512 ARP, Request who-has 10.0.1.2 tell 10.0.1.1, length 28
23:10:22.153512 ARP, Request who-has 10.0.1.2 tell 10.0.1.1, length 28
23:10:23.156199 ARP, Request who-has 10.0.1.2 tell 10.0.1.1, length 28
23:10:24.153512 ARP, Request who-has 10.0.1.2 tell 10.0.1.1, length 28
23:10:25.153512 ARP, Request who-has 10.0.1.2 tell 10.0.1.1, length 28
23:10:26.156883 ARP, Request who-has 10.0.1.2 tell 10.0.1.1, length 28
23:10:26.469883 STP 802.1d, Config, Flags [none], bridge-id 7fff.c0:56:27:5f:8a:85.8002, length 35
23:10:27.153514 ARP, Request who-has 10.0.1.2 tell 10.0.1.1, length 28
23:10:28.153507 ARP, Request who-has 10.0.1.2 tell 10.0.1.1, length 28
```

### Client side
```
23:50:42.577981 STP 802.1d, Config, Flags [none], bridge-id 7fff.c0:56:27:5f:8a:3d.8002, length 35
23:50:44.577969 STP 802.1d, Config, Flags [none], bridge-id 7fff.c0:56:27:5f:8a:3d.8002, length 35
23:50:46.578018 STP 802.1d, Config, Flags [none], bridge-id 7fff.c0:56:27:5f:8a:3d.8002, length 35
23:50:48.577976 STP 802.1d, Config, Flags [none], bridge-id 7fff.c0:56:27:5f:8a:3d.8002, length 35
```

I am happy to provide any other details you require, and to test anything you would like to try.

Thanks

**Comment by yuhhaurlin** [comment]
Mesh would be supported. I will close this item.

**Comment by onslauth** [comment]
Hi, 

What do you mean by 'mesh would be supported' ? Is this a new technology currently available in OpenWRT?

**Comment by mrefky** [comment]
I just buy WRT1200AC to be used in a WDS wifi repeater configuration, this is too bad not to have WDS supported ....

**Comment by fghaas** [comment]
I'm being bitten by this exact issue, though I wouldn't say it's limited to just ARP requests — rather it seems that no layer 2 broadcasts make it back to the "client side" at all. This also applies to DHCP offers. The "client side" properly forwards the discover packet, the "AP side" responds with an offer, the offer never makes it to the client.

@onslauth, did you ever get to the bottom of this?

**Comment by onslauth** [comment]
@fghaas Nah, I haven't actually used the devices since I bought them, I originally bought them in the hope of using them for WDS, and have not played with them since then.

**Comment by fghaas** [comment]
@onslauth For what it's worth, I got it to work by doing two things:

- Upgrade to LEDE (which currently runs on a 4.4.39 kernel)
- Restricting my setup to *one* WDS-enabled ESSID.

It appears that if more than one ESSID is defined with WDS in AP mode on the router, then the access points can only join one of them in STA mode. (It's OK to have other ESSIDs defined on the router, you just apparently can't scale those across multiple access points.) I'm not sure if this is an actual driver problem, or if it's something where the network stack on OpenWRT/LEDE simply uses the driver incorrectly.

**Comment by onslauth** [comment]
@fghaas OMG really? That's wonderful, I will spend the evening sorting this out.

When you say LEDE, what do you mean? Is that the new code name for OpenWRT release?

**Comment by fghaas** [comment]
[LEDE](https://lede-project.org/) is the Linux Embedded Development Environment, you can find downloads for the `mvebu` target (WRT1900AC/ACv2/ACS) are [here](https://downloads.lede-project.org/snapshots/targets/mvebu/generic/).

**Comment by onslauth** [comment]
@fghaas Hey, so let me get this straight, I was re-reading your previous comment, and if I understand you correctly, you have linked the two devices using WDS, but then have created different ESSIDs on each device for clients to join?

**Comment by onslauth** [comment]
@fghaas Ah, that sucks, I have the V1 edition. I see that on the [OpenWRT Forum](https://wiki.openwrt.org/toh/linksys/wrt1x00ac_series) they had links for LEDE for v1, but they links seem to be 404'd

**Comment by fghaas** [comment]
No, the ESSIDs and WPA2 PSKs are identical. The router has the network defined with `wds 1` and `mode ap`. The APs define the same network with `wds 1` and `mode sta` (that's the link to the router), and again with `wds 0` and `mode ap` (that's what Wi-Fi clients connect to).

Also, make sure that your APs explicitly set the router's BSSID. If you configure your networks with LuCI then this happens automatically; if you shell into your system then you must set it in `/etc/config/wireless`.

The LEDE and OpenWRT wikis have more information.

**Comment by fghaas** [comment]
Also, check https://downloads.lede-project.org/snapshots/targets/mvebu/generic/ again. The `wrt1900ac` links should be for you. No?

**Comment by onslauth** [comment]
@fghaas Thanks for all the help. I updated my routers to the latest LEDE build, and used LUCI to configure it and get it working.

Everything is working great, and thanks for letting me know about the update.

**Comment by fghaas** [comment]
Sweet! Glad to hear those boxes aren't collecting dust anymore. :)
