### ISSUE TITLE
Connection problems with Android clients

### ISSUE THREAD

**Issue by Alexander-r** [kaloz/mwlwifi#262]
On wrt3200acm with 10.3.4.0-20180118 and 9.3.2.4 firmware I have problems with Android clients.
If i use wrt3200acm as a dhcp server and try to connect my phone then it may take around a minute to get an IP address and the client reconnects to the network a couple of times before it gets the address.
If I set up wrt3200acm as a bridge and use another routers dhcp for lan clients then it takes 10-20 seconds for my phone to connect but after that it shows "Connected, no Internet". If it's the first time I connect to the network it asks if I want to stay connected. If I stay connected the network starts to work after some time.
If on the phone I turn wi-fi off and on and it starts reconnecting automatically then after it gets "Connected, no Internet" it disconnects from the network and tries reconnecting to it again. It stays in this connect/disconnect loop until I connect to the network manually again.

In both setups clients have access to internet.

This problem only affects my Android devices. My notebooks connects to the network without any problems.
I did not experience this problem with official 1.0.6.186168 firmware in both when wrt3200acm was a dhcp server and when it was in bridge mode.
All the phones that I tested have at least Android 7 on them.

**Comment by Alexander-r** [comment]
Small update. This only happens on 5GHz network. On 2.4GHz network clients connect normally and receive "Connected" status right after connection.

**Comment by yuhhaurlin** [comment]
Please let me know the phone you used. Thanks.

**Comment by yuhhaurlin** [comment]
1. Please help to confirm firmware 9.3.2.2 is all right.
2. Do you have lot of broadcast/multicast packets on your 5g band?

Thanks.

**Comment by yuhhaurlin** [comment]
F.Y.I. http://community.linksys.com/t5/Wireless-Routers/WiFi-Drops-and-Disconnects-with-Android-Devices-on-your-network/td-p/1263827.

**Comment by Alexander-r** [comment]
On firmware 9.3.2.2 it takes longer to connect to 5Ghz network then to 2.4GHz but the phone stays connected. After connection I still get "Connected, no Internet" for about 10 seconds before the phone sees internet.
I tested it with Oneplus 2 (Android 8.1.0 LineageOS 15.1) and Sony Xperia X Performance (stock Android 7.0 from Sony)

Almost all of my devices use 5GHz network as 2.4Ghz range is really crowded (I can see about a dozen 2.4GHz networks and only one other 5GHz network).
I've dumped traffic going through wlan0 on the router. For broadcast and multicast I see STP packets from wan router (one packet about every 5 seconds), ARP packets (usually 2 packets at the same time but not too often), ICMPv6 for router advertisement, solicitation and neighbor discovery and DHCPv6 as I have IPv6 set up (2-3 different requests at the same time about once every 10 seconds), SSDP packets (rare but sometimes a lot of packets at once), IGMPv2 (1-2 packets at once, rare), MDNS (5-6 packets at once about every 10 seconds).
MDNS packets are mostly from my Google Nexus Player (Android 8 stock from Google).
In 1209 seconds I got broadcast and multicast 6291 packets captured. I don't think that's a lot.

I know that there is a problem with some google devices. But that's usually affects network when the devices resumes from sleep and sends about 400 MDSN packets at once.
Also in the same environment my backup router does not experience this problems.

**Comment by yuhhaurlin** [comment]
Can you install the fixes and check if the problem is gone? Thanks.
BTW, can you set DTIM to 1 and check test result before installation of the fixes?

**Comment by Alexander-r** [comment]
Right now I have LEDE r5892-26045049ba with  mwlwifi a149180:
```
[    0.000000] Linux version 4.9.76 (sr@sr-pc) (gcc version 5.5.0 (OpenWrt GCC 5.5.0 r5892-26045049ba) ) #0 SMP Thu Jan 18 10:39:42 2018
...
[    9.494209] <<Marvell Mac80211 Wireless PCIE Network Driver version 10.3.4.0-20180118>>
[    9.502282] pci 0000:00:01.0: enabling device (0140 -> 0142)
[    9.508068] ieee80211 phy0: priv->pcmd_buf = dddfc000  priv->pphys_cmd_buf = 1ddfc000
[    9.548277] ieee80211 phy0: fw download start
[    9.548282] ieee80211 phy0: ddr init: download start
[    9.548660] ieee80211 phy0: ddr init: download complete
[    9.686033] ieee80211 phy0: FwSize = 449468 downloaded Size = 449468 curr_iteration 65522
[   12.557269] ieee80211 phy0: fw download complete
[   12.557308] ieee80211 phy0: device node: /soc/pcie-controller/pcie@1,0
[   12.573730] ieee80211 phy0: pcmd = dddfc000
[   12.590286] ieee80211 phy0: firmware version: 0x9030204
[   12.951271] ieee80211 phy0: firmware region code: 10
[   12.980890] ieee80211 phy0: 2G disabled, 5G enabled
[   12.985806] ieee80211 phy0: 4 TX antennas, 4 RX antennas
```
Or are there any newer fixes?

Do you want me to test changing DTIM  on 9.3.2.4 or on 9.3.2.2?

**Comment by yuhhaurlin** [comment]
Tested on 9.3.2.4. I means fixes from Google release on 1/18.

**Comment by godlessfather** [comment]
I've got two Chromecasts, two devices with Oreo, and two with Nougat. The
'Connected, no internet' issue happened for my Oreo devices prior to
switching to 9.3.2.4 and hasn't happened in the 14 hours that I've been
running the latest firmware. Previously, my two Oreo phones would take
longer than normal to connect to my router and find internet and would
occasionally lose their wireless connection during sleep. I've just
upgraded Google Play Services to the reported Cast fix.

**Comment by Alexander-r** [comment]
Here is station dump for when my phone tries to connect:
```
Station c0:ee:fb:46:7a:24 (on wlan0)
        inactive time:  480 ms
        rx bytes:       2716
        rx packets:     25
        tx bytes:       1045
        tx packets:     13
        tx retries:     0
        tx failed:      0
        rx drop misc:   0
        signal:         0 dBm
        signal avg:     0 dBm
        tx bitrate:     292.6 MBit/s VHT-MCS 6 80MHz short GI VHT-NSS 1
        rx bitrate:     54.0 MBit/s
        authorized:     yes
        authenticated:  yes
        associated:     yes
        preamble:       long
        WMM/WME:        yes
        MFP:            no
        TDLS peer:      no
        DTIM period:    1
        beacon interval:100
        short slot time:yes
        connected time: 3 seconds
```

Here is config for 5GHz network:
```
config wifi-device 'radio0'
        option type 'mac80211'
        option hwmode '11a'
        option path 'soc/soc:pcie-controller/pci0000:00/0000:00:01.0/0000:01:00.0'
        option ht_coex '1'
        option noscan '1'
        option country 'US'
        option legacy_rates '0'
        option htmode 'VHT80'
        option txpower '23'
        option channel '36'

config wifi-iface 'default_radio0'
        option device 'radio0'
        option mode 'ap'
        option ssid 'Test5'
        option encryption 'psk2+ccmp'
        option key '1234567890'
        option doth '0'
        option network 'wan'
        option dtim_period '1'
        option powersave '0'
```

I don't see any differences with DTIM set to 1.

So far Google Nexus Player tells me that there are no updates available.
It's not clear if it should be part of firmware update or just Google Play services update. Google Play services version on the device is 8.5.39.W-xhdpi [8] [PR] 178322352 (I think it was released on January 7, 2018) and it updates automatically.

**Comment by bg4drl** [comment]
Google Pixel 2 XL OPM2.171019.016 is out OTA

**Comment by bg4drl** [comment]
https://www.apkmirror.com/apk/google-inc/google-play-services/google-play-services-11-9-74-release/

**Comment by adamcarter1** [comment]
Just my two cents:

Vizio m65-E0 with built in chromecast seems to always disconnect at random, along the lines of what everyone is saying here. 

I use dd-wrt, using the newest build jan 19th 2018 and had to restart the router to allow connection. 

My firestick (an android device) and apple devices are unaffected by this problem.

I can’t test your lede stuff as i am a loyal dd-wrt user, but hoping this will be fixed soon.

**Comment by yuhhaurlin** [comment]
@Alexander-r Can I know which version of firmware is all right under your test environment?

**Comment by yuhhaurlin** [comment]
@Alexander-r Please help to verify 10.3.4.0-20180122-debug:

Factory: https://drive.google.com/open?id=14xLOFzs5u-vSwlvFVx-Y5H1AaxLMhVug
Upgrade: https://drive.google.com/open?id=1XuTVj2vpyqt9_N0YtD5PCzbgSLokimJf

Thanks.

**Comment by yuhhaurlin** [comment]
@Alexander-r I print out DHCPOFFER Broadcast packet and send it to different queue. Please help to check the LEDE image. Based on your test result, I can check how to debug the problem. Thanks.

**Comment by Alexander-r** [comment]
As I mentioned I did not notice this problems on 9.3.2.2 firmware for as long as the client could still connect to the network. And there are no problems with official Linksys 1.0.6.186168 firmware.

I've tested your lede build. Android clients still have problems on it.

Here is the log for Android device:
```
Tue Jan 23 12:37:06 2018 daemon.info hostapd: wlan0: STA c0:ee:fb:46:7a:24 IEEE 802.11: associated (aid 3)
Tue Jan 23 12:37:06 2018 daemon.notice hostapd: wlan0: AP-STA-CONNECTED c0:ee:fb:46:7a:24
Tue Jan 23 12:37:06 2018 daemon.info hostapd: wlan0: STA c0:ee:fb:46:7a:24 RADIUS: starting accounting session D091A5DF752B6ED2
Tue Jan 23 12:37:06 2018 daemon.info hostapd: wlan0: STA c0:ee:fb:46:7a:24 WPA: pairwise key handshake completed (RSN)
Tue Jan 23 12:37:07 2018 daemon.info dnsmasq-dhcp[2445]: DHCPDISCOVER(br-lan) c0:ee:fb:46:7a:24 
Tue Jan 23 12:37:07 2018 daemon.info dnsmasq-dhcp[2445]: DHCPOFFER(br-lan) 192.168.7.131 c0:ee:fb:46:7a:24 
Tue Jan 23 12:37:08 2018 daemon.info hostapd: wlan0: STA c0:ee:fb:46:7a:24 IEEE 802.11: authenticated
Tue Jan 23 12:37:12 2018 daemon.info dnsmasq-dhcp[2445]: DHCPDISCOVER(br-lan) c0:ee:fb:46:7a:24 
Tue Jan 23 12:37:12 2018 daemon.info dnsmasq-dhcp[2445]: DHCPOFFER(br-lan) 192.168.7.131 c0:ee:fb:46:7a:24 
Tue Jan 23 12:37:17 2018 daemon.info dnsmasq-dhcp[2445]: DHCPDISCOVER(br-lan) c0:ee:fb:46:7a:24 
Tue Jan 23 12:37:17 2018 daemon.info dnsmasq-dhcp[2445]: DHCPOFFER(br-lan) 192.168.7.131 c0:ee:fb:46:7a:24 
Tue Jan 23 12:37:24 2018 daemon.info dnsmasq-dhcp[2445]: DHCPDISCOVER(br-lan) c0:ee:fb:46:7a:24 
Tue Jan 23 12:37:24 2018 daemon.info dnsmasq-dhcp[2445]: DHCPOFFER(br-lan) 192.168.7.131 c0:ee:fb:46:7a:24 
Tue Jan 23 12:37:40 2018 daemon.info dnsmasq-dhcp[2445]: DHCPDISCOVER(br-lan) c0:ee:fb:46:7a:24 
Tue Jan 23 12:37:40 2018 daemon.info dnsmasq-dhcp[2445]: DHCPOFFER(br-lan) 192.168.7.131 c0:ee:fb:46:7a:24 
Tue Jan 23 12:37:43 2018 daemon.notice hostapd: wlan0: AP-STA-DISCONNECTED c0:ee:fb:46:7a:24
Tue Jan 23 12:37:43 2018 kern.debug kernel: [  393.688616] ieee80211 phy0: staid 3 deleted
Tue Jan 23 12:37:44 2018 daemon.info hostapd: wlan0: STA c0:ee:fb:46:7a:24 IEEE 802.11: associated (aid 3)
Tue Jan 23 12:37:44 2018 daemon.notice hostapd: wlan0: AP-STA-CONNECTED c0:ee:fb:46:7a:24
Tue Jan 23 12:37:44 2018 daemon.info hostapd: wlan0: STA c0:ee:fb:46:7a:24 RADIUS: starting accounting session B8F8D03F874FA414
Tue Jan 23 12:37:44 2018 daemon.info hostapd: wlan0: STA c0:ee:fb:46:7a:24 WPA: pairwise key handshake completed (RSN)
Tue Jan 23 12:37:44 2018 daemon.info hostapd: wlan0: STA c0:ee:fb:46:7a:24 IEEE 802.11: authenticated
Tue Jan 23 12:37:45 2018 daemon.info dnsmasq-dhcp[2445]: DHCPDISCOVER(br-lan) c0:ee:fb:46:7a:24 
Tue Jan 23 12:37:45 2018 daemon.info dnsmasq-dhcp[2445]: DHCPOFFER(br-lan) 192.168.7.131 c0:ee:fb:46:7a:24 
Tue Jan 23 12:37:50 2018 daemon.info dnsmasq-dhcp[2445]: DHCPDISCOVER(br-lan) c0:ee:fb:46:7a:24 
Tue Jan 23 12:37:50 2018 daemon.info dnsmasq-dhcp[2445]: DHCPOFFER(br-lan) 192.168.7.131 c0:ee:fb:46:7a:24 
Tue Jan 23 12:37:55 2018 daemon.info dnsmasq-dhcp[2445]: DHCPDISCOVER(br-lan) c0:ee:fb:46:7a:24 
Tue Jan 23 12:37:55 2018 daemon.info dnsmasq-dhcp[2445]: DHCPOFFER(br-lan) 192.168.7.131 c0:ee:fb:46:7a:24 
Tue Jan 23 12:38:03 2018 daemon.info dnsmasq-dhcp[2445]: DHCPDISCOVER(br-lan) c0:ee:fb:46:7a:24 
Tue Jan 23 12:38:03 2018 daemon.info dnsmasq-dhcp[2445]: DHCPOFFER(br-lan) 192.168.7.131 c0:ee:fb:46:7a:24 
Tue Jan 23 12:38:20 2018 daemon.info dnsmasq-dhcp[2445]: DHCPDISCOVER(br-lan) c0:ee:fb:46:7a:24 
Tue Jan 23 12:38:20 2018 daemon.info dnsmasq-dhcp[2445]: DHCPOFFER(br-lan) 192.168.7.131 c0:ee:fb:46:7a:24 
Tue Jan 23 12:38:20 2018 daemon.notice hostapd: wlan0: AP-STA-DISCONNECTED c0:ee:fb:46:7a:24
Tue Jan 23 12:38:20 2018 kern.debug kernel: [  431.598025] ieee80211 phy0: staid 3 deleted
Tue Jan 23 12:38:22 2018 daemon.info hostapd: wlan0: STA c0:ee:fb:46:7a:24 IEEE 802.11: associated (aid 3)
Tue Jan 23 12:38:22 2018 daemon.notice hostapd: wlan0: AP-STA-CONNECTED c0:ee:fb:46:7a:24
Tue Jan 23 12:38:22 2018 daemon.info hostapd: wlan0: STA c0:ee:fb:46:7a:24 RADIUS: starting accounting session 3F6D9F7FD4422A88
Tue Jan 23 12:38:22 2018 daemon.info hostapd: wlan0: STA c0:ee:fb:46:7a:24 WPA: pairwise key handshake completed (RSN)
Tue Jan 23 12:38:23 2018 daemon.info dnsmasq-dhcp[2445]: DHCPDISCOVER(br-lan) c0:ee:fb:46:7a:24 
Tue Jan 23 12:38:23 2018 daemon.info dnsmasq-dhcp[2445]: DHCPOFFER(br-lan) 192.168.7.131 c0:ee:fb:46:7a:24 
Tue Jan 23 12:38:23 2018 daemon.info hostapd: wlan0: STA c0:ee:fb:46:7a:24 IEEE 802.11: authenticated
Tue Jan 23 12:38:28 2018 daemon.info dnsmasq-dhcp[2445]: DHCPDISCOVER(br-lan) c0:ee:fb:46:7a:24 
Tue Jan 23 12:38:28 2018 daemon.info dnsmasq-dhcp[2445]: DHCPOFFER(br-lan) 192.168.7.131 c0:ee:fb:46:7a:24 
Tue Jan 23 12:38:33 2018 daemon.info dnsmasq-dhcp[2445]: DHCPDISCOVER(br-lan) c0:ee:fb:46:7a:24 
Tue Jan 23 12:38:33 2018 daemon.info dnsmasq-dhcp[2445]: DHCPOFFER(br-lan) 192.168.7.131 c0:ee:fb:46:7a:24 
Tue Jan 23 12:38:40 2018 daemon.info dnsmasq-dhcp[2445]: DHCPDISCOVER(br-lan) c0:ee:fb:46:7a:24 
Tue Jan 23 12:38:40 2018 daemon.info dnsmasq-dhcp[2445]: DHCPOFFER(br-lan) 192.168.7.131 c0:ee:fb:46:7a:24 
Tue Jan 23 12:38:40 2018 daemon.info dnsmasq-dhcp[2445]: DHCPREQUEST(br-lan) 192.168.7.131 c0:ee:fb:46:7a:24 
Tue Jan 23 12:38:40 2018 daemon.info dnsmasq-dhcp[2445]: DHCPACK(br-lan) 192.168.7.131 c0:ee:fb:46:7a:24 
```

And here is the log for my notebook:
```
Tue Jan 23 12:41:11 2018 daemon.info hostapd: wlan0: STA 64:80:99:98:f7:92 IEEE 802.11: associated (aid 1)
Tue Jan 23 12:41:11 2018 daemon.notice hostapd: wlan0: AP-STA-CONNECTED 64:80:99:98:f7:92
Tue Jan 23 12:41:11 2018 daemon.info hostapd: wlan0: STA 64:80:99:98:f7:92 RADIUS: starting accounting session 73B98EAA452533E8
Tue Jan 23 12:41:11 2018 daemon.info hostapd: wlan0: STA 64:80:99:98:f7:92 WPA: pairwise key handshake completed (RSN)
Tue Jan 23 12:41:13 2018 daemon.info dnsmasq-dhcp[2445]: DHCPDISCOVER(br-lan) 192.168.7.86 64:80:99:98:f7:92 
Tue Jan 23 12:41:13 2018 daemon.info dnsmasq-dhcp[2445]: DHCPOFFER(br-lan) 192.168.7.86 64:80:99:98:f7:92 
Tue Jan 23 12:41:13 2018 kern.warn kernel: [  604.199769] DHCPOFFER MC for 64:80:99:98:f7:92
Tue Jan 23 12:41:13 2018 kern.warn kernel: [  604.204239] DHCPOFFER MC for 64:80:99:98:f7:92
Tue Jan 23 12:41:13 2018 daemon.info dnsmasq-dhcp[2445]: DHCPREQUEST(br-lan) 192.168.7.86 64:80:99:98:f7:92 
Tue Jan 23 12:41:13 2018 daemon.info dnsmasq-dhcp[2445]: DHCPACK(br-lan) 192.168.7.86 64:80:99:98:f7:92 sr-note
Tue Jan 23 12:41:13 2018 kern.warn kernel: [  604.359708] DHCPOFFER MC for 64:80:99:98:f7:92
Tue Jan 23 12:41:13 2018 kern.warn kernel: [  604.364177] DHCPOFFER MC for 64:80:99:98:f7:92
Tue Jan 23 12:41:15 2018 daemon.info hostapd: wlan0: STA 64:80:99:98:f7:92 IEEE 802.11: authenticated
```

Even after android client connects to the network I don't see DHCPOFFER MC message from kernel log for it.

**Comment by yuhhaurlin** [comment]
It means your Andriod device does not ask for broadcast DHCPOFFER. Can you get log with firmware 9.3.2.2 for me. Use the LEDE image I posted and replace the firmware to 9.3.2.2.
It is very strange, the modification of 9.3.2.4 is related to broadcast and multicast packets.

**Comment by yuhhaurlin** [comment]
BTW, if you use DHCP server of LEDE, you can specify if DHCP server will reply broadcast DHCPOFFER.

vi /etc/config/dhcp 

add:

config host
    option ip 'IP for your Andriod phone'
    option mac 'MAC address of Andriod phone'
    option broadcast '0' or '1'

Please help to check if only unicast will have this problem. Thanks.

**Comment by yuhhaurlin** [comment]
BTW, can you let me know the Andriod phone you use?

**Comment by Alexander-r** [comment]
With option broadcast '1' set for client the client connects much faster and I don't see duplicate requests. But right after the phone connects it disconnects almost immediately and starts reconnecting.
I've also tested this with 9.3.2.2 firmware and the client also just connected and disconnected. Here is the log:
```
Wed Jan 24 20:51:38 2018 daemon.info hostapd: wlan0: STA c0:ee:fb:46:7a:24 IEEE 802.11: associated (aid 4)
Wed Jan 24 20:51:38 2018 daemon.notice hostapd: wlan0: AP-STA-CONNECTED c0:ee:fb:46:7a:24
Wed Jan 24 20:51:38 2018 daemon.info hostapd: wlan0: STA c0:ee:fb:46:7a:24 RADIUS: starting accounting session CD3A53C3E72087F8
Wed Jan 24 20:51:38 2018 daemon.info hostapd: wlan0: STA c0:ee:fb:46:7a:24 WPA: pairwise key handshake completed (RSN)
Wed Jan 24 20:51:38 2018 daemon.info dnsmasq-dhcp[2007]: DHCPDISCOVER(br-lan) c0:ee:fb:46:7a:24 
Wed Jan 24 20:51:38 2018 daemon.info dnsmasq-dhcp[2007]: DHCPOFFER(br-lan) 192.168.7.10 c0:ee:fb:46:7a:24 
Wed Jan 24 20:51:38 2018 kern.warn kernel: [  422.496349] DHCPOFFER MC for c0:ee:fb:46:7a:24
Wed Jan 24 20:51:38 2018 kern.warn kernel: [  422.500829] DHCPOFFER MC for c0:ee:fb:46:7a:24
Wed Jan 24 20:51:38 2018 daemon.info dnsmasq-dhcp[2007]: DHCPREQUEST(br-lan) 192.168.7.10 c0:ee:fb:46:7a:24 
Wed Jan 24 20:51:38 2018 daemon.info dnsmasq-dhcp[2007]: DHCPACK(br-lan) 192.168.7.10 c0:ee:fb:46:7a:24 OnePlus2
Wed Jan 24 20:51:38 2018 kern.warn kernel: [  422.571561] DHCPOFFER MC for c0:ee:fb:46:7a:24
Wed Jan 24 20:51:38 2018 kern.warn kernel: [  422.576033] DHCPOFFER MC for c0:ee:fb:46:7a:24
Wed Jan 24 20:51:40 2018 daemon.info hostapd: wlan0: STA c0:ee:fb:46:7a:24 IEEE 802.11: authenticated
Wed Jan 24 20:51:42 2018 daemon.notice hostapd: wlan0: AP-STA-DISCONNECTED c0:ee:fb:46:7a:24
Wed Jan 24 20:51:42 2018 kern.debug kernel: [  425.983204] ieee80211 phy0: staid 4 deleted
Wed Jan 24 20:51:43 2018 daemon.info hostapd: wlan0: STA c0:ee:fb:46:7a:24 IEEE 802.11: associated (aid 4)
Wed Jan 24 20:51:43 2018 daemon.notice hostapd: wlan0: AP-STA-CONNECTED c0:ee:fb:46:7a:24
Wed Jan 24 20:51:43 2018 daemon.info hostapd: wlan0: STA c0:ee:fb:46:7a:24 RADIUS: starting accounting session 85E7569307AACA7C
Wed Jan 24 20:51:43 2018 daemon.info hostapd: wlan0: STA c0:ee:fb:46:7a:24 WPA: pairwise key handshake completed (RSN)
Wed Jan 24 20:51:43 2018 daemon.info hostapd: wlan0: STA c0:ee:fb:46:7a:24 IEEE 802.11: authenticated
Wed Jan 24 20:51:44 2018 daemon.info dnsmasq-dhcp[2007]: DHCPDISCOVER(br-lan) c0:ee:fb:46:7a:24 
Wed Jan 24 20:51:44 2018 daemon.info dnsmasq-dhcp[2007]: DHCPOFFER(br-lan) 192.168.7.10 c0:ee:fb:46:7a:24 
Wed Jan 24 20:51:44 2018 kern.warn kernel: [  427.889556] DHCPOFFER MC for c0:ee:fb:46:7a:24
Wed Jan 24 20:51:44 2018 kern.warn kernel: [  427.894032] DHCPOFFER MC for c0:ee:fb:46:7a:24
Wed Jan 24 20:51:44 2018 daemon.info dnsmasq-dhcp[2007]: DHCPREQUEST(br-lan) 192.168.7.10 c0:ee:fb:46:7a:24 
Wed Jan 24 20:51:44 2018 daemon.info dnsmasq-dhcp[2007]: DHCPACK(br-lan) 192.168.7.10 c0:ee:fb:46:7a:24 OnePlus2
Wed Jan 24 20:51:44 2018 kern.warn kernel: [  427.995244] DHCPOFFER MC for c0:ee:fb:46:7a:24
Wed Jan 24 20:51:44 2018 kern.warn kernel: [  427.999720] DHCPOFFER MC for c0:ee:fb:46:7a:24
Wed Jan 24 20:51:47 2018 daemon.notice hostapd: wlan0: AP-STA-DISCONNECTED c0:ee:fb:46:7a:24
Wed Jan 24 20:51:47 2018 kern.debug kernel: [  431.422121] ieee80211 phy0: staid 4 deleted
```

The client was Oneplus 2 with Android 8.1.0.

**Comment by yuhhaurlin** [comment]
Only this client has problem?

**Comment by yuhhaurlin** [comment]
BTW, if you did not set broadcast reply, does firmware 9.3.2.2 work all right? You told me firmware 9.3.2.2 is all right for this phone. Can you get the log for unitcast  reply for firmware 9.3.2.2? Thanks.

**Comment by Alexander-r** [comment]
Only this client disconnects immediately. Sony Xperia X Performance (Android 7.0) does not disconnect from the network but it takes up to a minute after connection for it to go from "Connected, no Internet" to "Connected" status and be able to access anything.

Oneplus 2 is able to connect if I first select forget network and set it up again and after first connection select stay connected. After that it hangs for about a minute on "Connected, no Internet" before switching to "Connected". Here is a log for that with broadcast '1':
```
Thu Jan 25 17:26:14 2018 daemon.notice hostapd: wlan0: AP-STA-CONNECTED c0:ee:fb:46:7a:24
Thu Jan 25 17:26:14 2018 daemon.info hostapd: wlan0: STA c0:ee:fb:46:7a:24 RADIUS: starting accounting session 7A7F55FF639BCAD5
Thu Jan 25 17:26:14 2018 daemon.info hostapd: wlan0: STA c0:ee:fb:46:7a:24 WPA: pairwise key handshake completed (RSN)
Thu Jan 25 17:26:14 2018 daemon.info hostapd: wlan0: STA c0:ee:fb:46:7a:24 IEEE 802.11: authenticated
Thu Jan 25 17:26:15 2018 daemon.info dnsmasq-dhcp[2012]: DHCPDISCOVER(br-lan) c0:ee:fb:46:7a:24 
Thu Jan 25 17:26:15 2018 daemon.info dnsmasq-dhcp[2012]: DHCPOFFER(br-lan) 192.168.7.10 c0:ee:fb:46:7a:24 
Thu Jan 25 17:26:15 2018 kern.warn kernel: [  204.340759] DHCPOFFER MC for c0:ee:fb:46:7a:24
Thu Jan 25 17:26:15 2018 kern.warn kernel: [  204.345233] DHCPOFFER MC for c0:ee:fb:46:7a:24
Thu Jan 25 17:26:15 2018 daemon.info dnsmasq-dhcp[2012]: DHCPREQUEST(br-lan) 192.168.7.10 c0:ee:fb:46:7a:24 
Thu Jan 25 17:26:15 2018 daemon.info dnsmasq-dhcp[2012]: DHCPACK(br-lan) 192.168.7.10 c0:ee:fb:46:7a:24 OnePlus2
Thu Jan 25 17:26:15 2018 kern.warn kernel: [  204.381076] DHCPOFFER MC for c0:ee:fb:46:7a:24
Thu Jan 25 17:26:15 2018 kern.warn kernel: [  204.385544] DHCPOFFER MC for c0:ee:fb:46:7a:24
```

And here is the log for unitcast connection:
```
Thu Jan 25 17:16:17 2018 daemon.notice hostapd: wlan0: AP-STA-CONNECTED c0:ee:fb:46:7a:24
Thu Jan 25 17:16:17 2018 daemon.info hostapd: wlan0: STA c0:ee:fb:46:7a:24 RADIUS: starting accounting session 682AC9DBFBA230C9
Thu Jan 25 17:16:17 2018 daemon.info hostapd: wlan0: STA c0:ee:fb:46:7a:24 WPA: pairwise key handshake completed (RSN)
Thu Jan 25 17:16:17 2018 daemon.info dnsmasq-dhcp[2013]: DHCPDISCOVER(br-lan) c0:ee:fb:46:7a:24 
Thu Jan 25 17:16:17 2018 daemon.info dnsmasq-dhcp[2013]: DHCPOFFER(br-lan) 192.168.7.10 c0:ee:fb:46:7a:24 
Thu Jan 25 17:16:22 2018 daemon.info dnsmasq-dhcp[2013]: DHCPDISCOVER(br-lan) c0:ee:fb:46:7a:24 
Thu Jan 25 17:16:22 2018 daemon.info dnsmasq-dhcp[2013]: DHCPOFFER(br-lan) 192.168.7.10 c0:ee:fb:46:7a:24 
Thu Jan 25 17:16:27 2018 daemon.info dnsmasq-dhcp[2013]: DHCPDISCOVER(br-lan) c0:ee:fb:46:7a:24 
Thu Jan 25 17:16:27 2018 daemon.info dnsmasq-dhcp[2013]: DHCPOFFER(br-lan) 192.168.7.10 c0:ee:fb:46:7a:24 
Thu Jan 25 17:16:36 2018 daemon.info dnsmasq-dhcp[2013]: DHCPDISCOVER(br-lan) c0:ee:fb:46:7a:24 
Thu Jan 25 17:16:36 2018 daemon.info dnsmasq-dhcp[2013]: DHCPOFFER(br-lan) 192.168.7.10 c0:ee:fb:46:7a:24 
Thu Jan 25 17:16:41 2018 daemon.info hostapd: wlan0: STA c0:ee:fb:46:7a:24 IEEE 802.11: authenticated
Thu Jan 25 17:16:51 2018 daemon.info dnsmasq-dhcp[2013]: DHCPDISCOVER(br-lan) c0:ee:fb:46:7a:24 
Thu Jan 25 17:16:51 2018 daemon.info dnsmasq-dhcp[2013]: DHCPOFFER(br-lan) 192.168.7.10 c0:ee:fb:46:7a:24 
Thu Jan 25 17:16:53 2018 daemon.notice hostapd: wlan0: AP-STA-DISCONNECTED c0:ee:fb:46:7a:24
Thu Jan 25 17:16:53 2018 kern.debug kernel: [  176.418274] ieee80211 phy0: staid 4 deleted
Thu Jan 25 17:16:55 2018 daemon.info hostapd: wlan0: STA c0:ee:fb:46:7a:24 IEEE 802.11: associated (aid 4)
Thu Jan 25 17:16:55 2018 daemon.notice hostapd: wlan0: AP-STA-CONNECTED c0:ee:fb:46:7a:24
Thu Jan 25 17:16:55 2018 daemon.info hostapd: wlan0: STA c0:ee:fb:46:7a:24 RADIUS: starting accounting session AE5878DBC0FF76DC
Thu Jan 25 17:16:55 2018 daemon.info hostapd: wlan0: STA c0:ee:fb:46:7a:24 WPA: pairwise key handshake completed (RSN)
Thu Jan 25 17:16:55 2018 daemon.info dnsmasq-dhcp[2013]: DHCPDISCOVER(br-lan) c0:ee:fb:46:7a:24 
Thu Jan 25 17:16:55 2018 daemon.info dnsmasq-dhcp[2013]: DHCPOFFER(br-lan) 192.168.7.10 c0:ee:fb:46:7a:24 
Thu Jan 25 17:16:55 2018 daemon.info hostapd: wlan0: STA c0:ee:fb:46:7a:24 IEEE 802.11: authenticated
Thu Jan 25 17:17:00 2018 daemon.info dnsmasq-dhcp[2013]: DHCPDISCOVER(br-lan) c0:ee:fb:46:7a:24 
Thu Jan 25 17:17:00 2018 daemon.info dnsmasq-dhcp[2013]: DHCPOFFER(br-lan) 192.168.7.10 c0:ee:fb:46:7a:24 
Thu Jan 25 17:17:05 2018 daemon.info dnsmasq-dhcp[2013]: DHCPDISCOVER(br-lan) c0:ee:fb:46:7a:24 
Thu Jan 25 17:17:05 2018 daemon.info dnsmasq-dhcp[2013]: DHCPOFFER(br-lan) 192.168.7.10 c0:ee:fb:46:7a:24 
Thu Jan 25 17:17:13 2018 daemon.info dnsmasq-dhcp[2013]: DHCPDISCOVER(br-lan) c0:ee:fb:46:7a:24 
Thu Jan 25 17:17:13 2018 daemon.info dnsmasq-dhcp[2013]: DHCPOFFER(br-lan) 192.168.7.10 c0:ee:fb:46:7a:24 
Thu Jan 25 17:17:28 2018 daemon.info dnsmasq-dhcp[2013]: DHCPDISCOVER(br-lan) c0:ee:fb:46:7a:24 
Thu Jan 25 17:17:28 2018 daemon.info dnsmasq-dhcp[2013]: DHCPOFFER(br-lan) 192.168.7.10 c0:ee:fb:46:7a:24 
Thu Jan 25 17:17:28 2018 daemon.info dnsmasq-dhcp[2013]: DHCPREQUEST(br-lan) 192.168.7.10 c0:ee:fb:46:7a:24 
Thu Jan 25 17:17:28 2018 daemon.info dnsmasq-dhcp[2013]: DHCPACK(br-lan) 192.168.7.10 c0:ee:fb:46:7a:24 OnePlus2
```

Is there a way to get any detailed logs on official Linksys firmware 1.0.6.186168? Because with that firmware this clients work without any problems.

**Comment by Alexander-r** [comment]
I've tried to check what is happening on the network when the phone tries to connect.
On official firmware in bridge mode when the phone connects I see DHCP requests, ARP requests, DNS requests and HTTP request checking internet connection and after that there is normal traffic flow.
On LEDE (also in bridge mode so that I get similar setup) in addition to this I see a lot of MDNS requests right after connection. On first connection after reboot there were 29 MDNS packets and the phone disconnected that time. On successful connection there were 8 MDNS requests right after connection.
There were no MDNS packets on the network with official firmware ar all. It seems Linksys fix for the problem was to drop all MDNS traffic altogether.
Maybe this information might be useful.

**Comment by yuhhaurlin** [comment]
1. So all firmware has this problem for LEDE?
2. The problem is related to the fix of Google.
3. I will check what is fixed by Google.

**Comment by adamcarter1** [comment]
And chromecast devices. Like my vizio tv.

**Comment by yuhhaurlin** [comment]
Thanks. BTW, if you install fix from Google, did you still encounter problem?

**Comment by bbogey** [comment]
I haven't seen the problem with my wrt1900acs, but this is how it looks when I wake up my Android phone. So just by opening the lock screen, not even unlocking it.

I have two chromecasts, Google Play Services 11.9.51 updated on 30.11.2017.
It keeps spamming that multicast traffic all the time when screen on, about 20 packets / second.

````#  tcpdump -i eth1 -s0 -vv net 224.0.0.0/4 -tttt
tcpdump: listening on eth1, link-type EN10MB (Ethernet), capture size 262144 bytes
2018-01-26 02:04:54.729649 IP (tos 0x0, ttl 255, id 50038, offset 0, flags [DF], proto UDP (17), length 138)
    192.168.1.140.5353 > 224.0.0.251.5353: [udp sum ok] 20891 [3q] PTR (QM)? _%9E5E7C8F47989526C9BCD95D24084F6F0B27C5ED._sub._googlecast._tcp.local. PTR (QM)? _CC32E753._sub._googlecast._tcp.local. PTR (QM)? _googlecast._tcp.local. (110)
2018-01-26 02:04:54.729798 IP (tos 0x0, ttl 255, id 50039, offset 0, flags [DF], proto UDP (17), length 138)
    192.168.1.140.5353 > 224.0.0.251.5353: [udp sum ok] 16613 [3q] PTR (QM)? _%9E5E7C8F47989526C9BCD95D24084F6F0B27C5ED._sub._googlecast._tcp.local. PTR (QM)? _CA5E8412._sub._googlecast._tcp.local. PTR (QM)? _googlecast._tcp.local. (110)
2018-01-26 02:04:54.730561 IP (tos 0x0, ttl 255, id 50040, offset 0, flags [DF], proto UDP (17), length 122)
    192.168.1.140.5353 > 224.0.0.251.5353: [udp sum ok] 20213 [2q] PTR (QM)? _%9E5E7C8F47989526C9BCD95D24084F6F0B27C5ED._sub._googlecast._tcp.local. PTR (QM)? _googlecast._tcp.local. (94)
2018-01-26 02:04:54.730698 IP (tos 0x0, ttl 255, id 50041, offset 0, flags [DF], proto UDP (17), length 138)
    192.168.1.140.5353 > 224.0.0.251.5353: [udp sum ok] 15458 [3q] PTR (QM)? _%9E5E7C8F47989526C9BCD95D24084F6F0B27C5ED._sub._googlecast._tcp.local. PTR (QM)? _CA5E8412._sub._googlecast._tcp.local. PTR (QM)? _googlecast._tcp.local. (110)
2018-01-26 02:04:54.730774 IP (tos 0x0, ttl 255, id 50042, offset 0, flags [DF], proto UDP (17), length 122)
    192.168.1.140.5353 > 224.0.0.251.5353: [udp sum ok] 20423 [2q] PTR (QM)? _%9E5E7C8F47989526C9BCD95D24084F6F0B27C5ED._sub._googlecast._tcp.local. PTR (QM)? _googlecast._tcp.local. (94)
2018-01-26 02:04:54.730850 IP (tos 0x0, ttl 255, id 50043, offset 0, flags [DF], proto UDP (17), length 138)
    192.168.1.140.5353 > 224.0.0.251.5353: [udp sum ok] 16319 [3q] PTR (QM)? _%9E5E7C8F47989526C9BCD95D24084F6F0B27C5ED._sub._googlecast._tcp.local. PTR (QM)? _CA5E8412._sub._googlecast._tcp.local. PTR (QM)? _googlecast._tcp.local. (110)
2018-01-26 02:04:54.730927 IP (tos 0x0, ttl 255, id 50044, offset 0, flags [DF], proto UDP (17), length 138)
    192.168.1.140.5353 > 224.0.0.251.5353: [udp sum ok] 16550 [3q] PTR (QM)? _%9E5E7C8F47989526C9BCD95D24084F6F0B27C5ED._sub._googlecast._tcp.local. PTR (QM)? _CA5E8412._sub._googlecast._tcp.local. PTR (QM)? _googlecast._tcp.local. (110)
2018-01-26 02:04:54.742010 IP (tos 0x0, ttl 255, id 50092, offset 0, flags [DF], proto UDP (17), length 89)
    192.168.1.140.5353 > 224.0.0.251.5353: [udp sum ok] 15534 [2q] PTR (QM)? _CA5E8412._sub._googlecast._tcp.local. PTR (QM)? _googlecast._tcp.local. (61)
2018-01-26 02:04:54.742189 IP (tos 0x0, ttl 255, id 50093, offset 0, flags [DF], proto UDP (17), length 122)
    192.168.1.140.5353 > 224.0.0.251.5353: [udp sum ok] 4793 [2q] PTR (QM)? _%9E5E7C8F47989526C9BCD95D24084F6F0B27C5ED._sub._googlecast._tcp.local. PTR (QM)? _googlecast._tcp.local. (94)
2018-01-26 02:04:54.742275 IP (tos 0x0, ttl 255, id 50094, offset 0, flags [DF], proto UDP (17), length 138)
    192.168.1.140.5353 > 224.0.0.251.5353: [udp sum ok] 19817 [3q] PTR (QM)? _%9E5E7C8F47989526C9BCD95D24084F6F0B27C5ED._sub._googlecast._tcp.local. PTR (QM)? _CA5E8412._sub._googlecast._tcp.local. PTR (QM)? _googlecast._tcp.local. (110)
2018-01-26 02:04:54.744072 IP (tos 0x0, ttl 255, id 50095, offset 0, flags [DF], proto UDP (17), length 154)
    192.168.1.140.5353 > 224.0.0.251.5353: [udp sum ok] 13916 [4q] PTR (QM)? _%9E5E7C8F47989526C9BCD95D24084F6F0B27C5ED._sub._googlecast._tcp.local. PTR (QM)? _CA5E8412._sub._googlecast._tcp.local. PTR (QM)? _9CB11073._sub._googlecast._tcp.local. PTR (QM)? _googlecast._tcp.local. (126)
2018-01-26 02:04:54.744223 IP (tos 0x0, ttl 255, id 50096, offset 0, flags [DF], proto UDP (17), length 138)
    192.168.1.140.5353 > 224.0.0.251.5353: [udp sum ok] 6164 [3q] PTR (QM)? _%9E5E7C8F47989526C9BCD95D24084F6F0B27C5ED._sub._googlecast._tcp.local. PTR (QM)? _CA5E8412._sub._googlecast._tcp.local. PTR (QM)? _googlecast._tcp.local. (110)
2018-01-26 02:04:54.744299 IP (tos 0x0, ttl 255, id 50097, offset 0, flags [DF], proto UDP (17), length 89)
    192.168.1.140.5353 > 224.0.0.251.5353: [udp sum ok] 8873 [2q] PTR (QM)? _9CB11073._sub._googlecast._tcp.local. PTR (QM)? _googlecast._tcp.local. (61)
2018-01-26 02:04:54.744371 IP (tos 0x0, ttl 255, id 50098, offset 0, flags [DF], proto UDP (17), length 122)
    192.168.1.140.5353 > 224.0.0.251.5353: [udp sum ok] 2692 [2q] PTR (QM)? _%9E5E7C8F47989526C9BCD95D24084F6F0B27C5ED._sub._googlecast._tcp.local. PTR (QM)? _googlecast._tcp.local. (94)
2018-01-26 02:04:54.744442 IP (tos 0x0, ttl 255, id 50099, offset 0, flags [DF], proto UDP (17), length 154)
    192.168.1.140.5353 > 224.0.0.251.5353: [udp sum ok] 14909 [4q] PTR (QM)? _37F83649._sub._googlecast._tcp.local. PTR (QM)? _%9E5E7C8F47989526C9BCD95D24084F6F0B27C5ED._sub._googlecast._tcp.local. PTR (QM)? _CA5E8412._sub._googlecast._tcp.local. PTR (QM)? _googlecast._tcp.local. (126)
2018-01-26 02:04:55.449854 IP (tos 0x0, ttl 255, id 50217, offset 0, flags [DF], proto UDP (17), length 122)
    192.168.1.140.5353 > 224.0.0.251.5353: [udp sum ok] 6045 [2q] PTR (QM)? _%9E5E7C8F47989526C9BCD95D24084F6F0B27C5ED._sub._googlecast._tcp.local. PTR (QM)? _googlecast._tcp.local. (94)
2018-01-26 02:04:55.450004 IP (tos 0x0, ttl 255, id 50218, offset 0, flags [DF], proto UDP (17), length 138)
    192.168.1.140.5353 > 224.0.0.251.5353: [udp sum ok] 15141 [3q] PTR (QM)? _%9E5E7C8F47989526C9BCD95D24084F6F0B27C5ED._sub._googlecast._tcp.local. PTR (QM)? _CA5E8412._sub._googlecast._tcp.local. PTR (QM)? _googlecast._tcp.local. (110)
2018-01-26 02:04:55.454797 IP (tos 0x0, ttl 255, id 50219, offset 0, flags [DF], proto UDP (17), length 89)
    192.168.1.140.5353 > 224.0.0.251.5353: [udp sum ok] 14445 [2q] PTR (QM)? _CA5E8412._sub._googlecast._tcp.local. PTR (QM)? _googlecast._tcp.local. (61)
2018-01-26 02:04:55.465580 IP (tos 0x0, ttl 255, id 50220, offset 0, flags [DF], proto UDP (17), length 122)
    192.168.1.140.5353 > 224.0.0.251.5353: [udp sum ok] 2310 [2q] PTR (QM)? _%9E5E7C8F47989526C9BCD95D24084F6F0B27C5ED._sub._googlecast._tcp.local. PTR (QM)? _googlecast._tcp.local. (94)
2018-01-26 02:04:55.564096 IP (tos 0x0, ttl 255, id 40660, offset 0, flags [DF], proto UDP (17), length 157)
    192.168.1.228.5353 > 224.0.0.251.5353: [udp sum ok] 0*- [0q] 1/0/0 Kodi (Olkkari)._airplay._tcp.local. (Cache flush) TXT "features=0x20F7" "srcvers=101.28" "model=Xbmc,1" "deviceid=C4:4E:89:E5:36:04" (129)
2018-01-26 02:04:55.694587 IP (tos 0x0, ttl 255, id 50235, offset 0, flags [DF], proto UDP (17), length 89)
    192.168.1.140.5353 > 224.0.0.251.5353: [udp sum ok] 2 [2q] PTR (QM)? _37F83649._sub._googlecast._tcp.local. PTR (QM)? _googlecast._tcp.local. (61)
2018-01-26 02:04:55.694733 IP (tos 0x0, ttl 255, id 50236, offset 0, flags [DF], proto UDP (17), length 138)
    192.168.1.140.5353 > 224.0.0.251.5353: [udp sum ok] 2 [3q] PTR (QM)? _37F83649._sub._googlecast._tcp.local. PTR (QM)? _%9E5E7C8F47989526C9BCD95D24084F6F0B27C5ED._sub._googlecast._tcp.local. PTR (QM)? _googlecast._tcp.local. (110)
2018-01-26 02:04:56.567326 IP (tos 0x0, ttl 255, id 40702, offset 0, flags [DF], proto UDP (17), length 157)
    192.168.1.228.5353 > 224.0.0.251.5353: [udp sum ok] 0*- [0q] 1/0/0 Kodi (Olkkari)._airplay._tcp.local. (Cache flush) TXT "features=0x20F7" "srcvers=101.28" "model=Xbmc,1" "deviceid=C4:4E:89:E5:36:04" (129)
2018-01-26 02:04:56.696443 IP (tos 0x0, ttl 255, id 50255, offset 0, flags [DF], proto UDP (17), length 89)
    192.168.1.140.5353 > 224.0.0.251.5353: [udp sum ok] 3 [2q] PTR (QM)? _37F83649._sub._googlecast._tcp.local. PTR (QM)? _googlecast._tcp.local. (61)
2018-01-26 02:04:56.696591 IP (tos 0x0, ttl 255, id 50256, offset 0, flags [DF], proto UDP (17), length 138)
    192.168.1.140.5353 > 224.0.0.251.5353: [udp sum ok] 3 [3q] PTR (QM)? _37F83649._sub._googlecast._tcp.local. PTR (QM)? _%9E5E7C8F47989526C9BCD95D24084F6F0B27C5ED._sub._googlecast._tcp.local. PTR (QM)? _googlecast._tcp.local. (110)
2018-01-26 02:04:57.172166 IP (tos 0x0, ttl 255, id 50270, offset 0, flags [DF], proto UDP (17), length 122)
    192.168.1.140.5353 > 224.0.0.251.5353: [udp sum ok] 2086 [2q] PTR (QM)? _%9E5E7C8F47989526C9BCD95D24084F6F0B27C5ED._sub._googlecast._tcp.local. PTR (QM)? _googlecast._tcp.local. (94)
2018-01-26 02:04:57.514052 IP (tos 0x0, ttl 255, id 50295, offset 0, flags [DF], proto UDP (17), length 89)
    192.168.1.140.5353 > 224.0.0.251.5353: [udp sum ok] 61 [2q] PTR (QM)? _37F83649._sub._googlecast._tcp.local. PTR (QM)? _googlecast._tcp.local. (61)
2018-01-26 02:04:58.198893 IP (tos 0x0, ttl 255, id 50332, offset 0, flags [DF], proto UDP (17), length 122)
    192.168.1.140.5353 > 224.0.0.251.5353: [udp sum ok] 2087 [2q] PTR (QM)? _%9E5E7C8F47989526C9BCD95D24084F6F0B27C5ED._sub._googlecast._tcp.local. PTR (QM)? _googlecast._tcp.local. (94)
2018-01-26 02:04:58.524921 IP (tos 0x0, ttl 255, id 50343, offset 0, flags [DF], proto UDP (17), length 89)
    192.168.1.140.5353 > 224.0.0.251.5353: [udp sum ok] 62 [2q] PTR (QM)? _37F83649._sub._googlecast._tcp.local. PTR (QM)? _googlecast._tcp.local. (61)
2018-01-26 02:04:58.570688 IP (tos 0x0, ttl 255, id 40757, offset 0, flags [DF], proto UDP (17), length 157)
    192.168.1.228.5353 > 224.0.0.251.5353: [udp sum ok] 0*- [0q] 1/0/0 Kodi (Olkkari)._airplay._tcp.local. (Cache flush) TXT "features=0x20F7" "srcvers=101.28" "model=Xbmc,1" "deviceid=C4:4E:89:E5:36:04" (129)
2018-01-26 02:04:59.094828 IP (tos 0x0, ttl 255, id 50369, offset 0, flags [DF], proto UDP (17), length 122)
    192.168.1.140.5353 > 224.0.0.251.5353: [udp sum ok] 2088 [2q] PTR (QM)? _%9E5E7C8F47989526C9BCD95D24084F6F0B27C5ED._sub._googlecast._tcp.local. PTR (QM)? _googlecast._tcp.local. (94)
2018-01-26 02:04:59.216154 IP (tos 0x0, ttl 255, id 50370, offset 0, flags [DF], proto UDP (17), length 138)
    192.168.1.140.5353 > 224.0.0.251.5353: [udp sum ok] 14452 [3q] PTR (QM)? _%9E5E7C8F47989526C9BCD95D24084F6F0B27C5ED._sub._googlecast._tcp.local. PTR (QM)? _CA5E8412._sub._googlecast._tcp.local. PTR (QM)? _googlecast._tcp.local. (110)
2018-01-26 02:04:59.524327 IP (tos 0x0, ttl 255, id 50383, offset 0, flags [DF], proto UDP (17), length 89)
    192.168.1.140.5353 > 224.0.0.251.5353: [udp sum ok] 63 [2q] PTR (QM)? _37F83649._sub._googlecast._tcp.local. PTR (QM)? _googlecast._tcp.local. (61)
2018-01-26 02:05:00.221423 IP (tos 0x0, ttl 255, id 50428, offset 0, flags [DF], proto UDP (17), length 138)
    192.168.1.140.5353 > 224.0.0.251.5353: [udp sum ok] 14453 [3q] PTR (QM)? _%9E5E7C8F47989526C9BCD95D24084F6F0B27C5ED._sub._googlecast._tcp.local. PTR (QM)? _CA5E8412._sub._googlecast._tcp.local. PTR (QM)? _googlecast._tcp.local. (110)
2018-01-26 02:05:00.245088 IP (tos 0x0, ttl 255, id 50429, offset 0, flags [DF], proto UDP (17), length 122)
    192.168.1.140.5353 > 224.0.0.251.5353: [udp sum ok] 6145 [2q] PTR (QM)? _%9E5E7C8F47989526C9BCD95D24084F6F0B27C5ED._sub._googlecast._tcp.local. PTR (QM)? _googlecast._tcp.local. (94)
2018-01-26 02:05:00.403666 IP (tos 0x0, ttl 255, id 50442, offset 0, flags [DF], proto UDP (17), length 89)
    192.168.1.140.5353 > 224.0.0.251.5353: [udp sum ok] 15535 [2q] PTR (QM)? _CA5E8412._sub._googlecast._tcp.local. PTR (QM)? _googlecast._tcp.local. (61)
2018-01-26 02:05:01.223519 IP (tos 0x0, ttl 255, id 50518, offset 0, flags [DF], proto UDP (17), length 138)
    192.168.1.140.5353 > 224.0.0.251.5353: [udp sum ok] 14454 [3q] PTR (QM)? _%9E5E7C8F47989526C9BCD95D24084F6F0B27C5ED._sub._googlecast._tcp.local. PTR (QM)? _CA5E8412._sub._googlecast._tcp.local. PTR (QM)? _googlecast._tcp.local. (110)
2018-01-26 02:05:01.247811 IP (tos 0x0, ttl 255, id 50520, offset 0, flags [DF], proto UDP (17), length 122)
    192.168.1.140.5353 > 224.0.0.251.5353: [udp sum ok] 6146 [2q] PTR (QM)? _%9E5E7C8F47989526C9BCD95D24084F6F0B27C5ED._sub._googlecast._tcp.local. PTR (QM)? _googlecast._tcp.local. (94)
2018-01-26 02:05:01.405134 IP (tos 0x0, ttl 255, id 50532, offset 0, flags [DF], proto UDP (17), length 89)
    192.168.1.140.5353 > 224.0.0.251.5353: [udp sum ok] 15536 [2q] PTR (QM)? _CA5E8412._sub._googlecast._tcp.local. PTR (QM)? _googlecast._tcp.local. (61)
2018-01-26 02:05:01.702889 IP (tos 0x0, ttl 255, id 50550, offset 0, flags [DF], proto UDP (17), length 89)
    192.168.1.140.5353 > 224.0.0.251.5353: [udp sum ok] 4 [2q] PTR (QM)? _37F83649._sub._googlecast._tcp.local. PTR (QM)? _googlecast._tcp.local. (61)
2018-01-26 02:05:01.703036 IP (tos 0x0, ttl 255, id 50551, offset 0, flags [DF], proto UDP (17), length 138)
    192.168.1.140.5353 > 224.0.0.251.5353: [udp sum ok] 4 [3q] PTR (QM)? _37F83649._sub._googlecast._tcp.local. PTR (QM)? _%9E5E7C8F47989526C9BCD95D24084F6F0B27C5ED._sub._googlecast._tcp.local. PTR (QM)? _googlecast._tcp.local. (110)
2018-01-26 02:05:02.021214 IP (tos 0x0, ttl 255, id 50572, offset 0, flags [DF], proto UDP (17), length 122)
    192.168.1.140.5353 > 224.0.0.251.5353: [udp sum ok] 4795 [2q] PTR (QM)? _%9E5E7C8F47989526C9BCD95D24084F6F0B27C5ED._sub._googlecast._tcp.local. PTR (QM)? _googlecast._tcp.local. (94)
2018-01-26 02:05:02.051518 IP (tos 0x0, ttl 255, id 50573, offset 0, flags [DF], proto UDP (17), length 138)
    192.168.1.140.5353 > 224.0.0.251.5353: [udp sum ok] 19819 [3q] PTR (QM)? _%9E5E7C8F47989526C9BCD95D24084F6F0B27C5ED._sub._googlecast._tcp.local. PTR (QM)? _CA5E8412._sub._googlecast._tcp.local. PTR (QM)? _googlecast._tcp.local. (110)
2018-01-26 02:05:02.052846 IP (tos 0x0, ttl 255, id 50574, offset 0, flags [DF], proto UDP (17), length 154)
    192.168.1.140.5353 > 224.0.0.251.5353: [udp sum ok] 13918 [4q] PTR (QM)? _%9E5E7C8F47989526C9BCD95D24084F6F0B27C5ED._sub._googlecast._tcp.local. PTR (QM)? _CA5E8412._sub._googlecast._tcp.local. PTR (QM)? _9CB11073._sub._googlecast._tcp.local. PTR (QM)? _googlecast._tcp.local. (126)
2018-01-26 02:05:02.055835 IP (tos 0x0, ttl 255, id 50575, offset 0, flags [DF], proto UDP (17), length 138)
    192.168.1.140.5353 > 224.0.0.251.5353: [udp sum ok] 6166 [3q] PTR (QM)? _%9E5E7C8F47989526C9BCD95D24084F6F0B27C5ED._sub._googlecast._tcp.local. PTR (QM)? _CA5E8412._sub._googlecast._tcp.local. PTR (QM)? _googlecast._tcp.local. (110)
2018-01-26 02:05:02.061630 IP (tos 0x0, ttl 255, id 50576, offset 0, flags [DF], proto UDP (17), length 89)
    192.168.1.140.5353 > 224.0.0.251.5353: [udp sum ok] 8875 [2q] PTR (QM)? _9CB11073._sub._googlecast._tcp.local. PTR (QM)? _googlecast._tcp.local. (61)
2018-01-26 02:05:02.141660 IP (tos 0x0, ttl 255, id 50579, offset 0, flags [DF], proto UDP (17), length 154)
    192.168.1.140.5353 > 224.0.0.251.5353: [udp sum ok] 14911 [4q] PTR (QM)? _37F83649._sub._googlecast._tcp.local. PTR (QM)? _%9E5E7C8F47989526C9BCD95D24084F6F0B27C5ED._sub._googlecast._tcp.local. PTR (QM)? _CA5E8412._sub._googlecast._tcp.local. PTR (QM)? _googlecast._tcp.local. (126)
2018-01-26 02:05:02.253880 IP (tos 0x0, ttl 255, id 50588, offset 0, flags [DF], proto UDP (17), length 122)
    192.168.1.140.5353 > 224.0.0.251.5353: [udp sum ok] 6147 [2q] PTR (QM)? _%9E5E7C8F47989526C9BCD95D24084F6F0B27C5ED._sub._googlecast._tcp.local. PTR (QM)? _googlecast._tcp.local. (94)
2018-01-26 02:05:02.409855 IP (tos 0x0, ttl 255, id 50599, offset 0, flags [DF], proto UDP (17), length 89)
    192.168.1.140.5353 > 224.0.0.251.5353: [udp sum ok] 15537 [2q] PTR (QM)? _CA5E8412._sub._googlecast._tcp.local. PTR (QM)? _googlecast._tcp.local. (61)
2018-01-26 02:05:02.706199 IP (tos 0x0, ttl 255, id 50614, offset 0, flags [DF], proto UDP (17), length 89)
    192.168.1.140.5353 > 224.0.0.251.5353: [udp sum ok] 5 [2q] PTR (QM)? _37F83649._sub._googlecast._tcp.local. PTR (QM)? _googlecast._tcp.local. (61)
2018-01-26 02:05:02.712629 IP (tos 0x0, ttl 255, id 50615, offset 0, flags [DF], proto UDP (17), length 138)
    192.168.1.140.5353 > 224.0.0.251.5353: [udp sum ok] 5 [3q] PTR (QM)? _37F83649._sub._googlecast._tcp.local. PTR (QM)? _%9E5E7C8F47989526C9BCD95D24084F6F0B27C5ED._sub._googlecast._tcp.local. PTR (QM)? _googlecast._tcp.local. (110)
2018-01-26 02:05:03.023559 IP (tos 0x0, ttl 255, id 50632, offset 0, flags [DF], proto UDP (17), length 122)
    192.168.1.140.5353 > 224.0.0.251.5353: [udp sum ok] 4796 [2q] PTR (QM)? _%9E5E7C8F47989526C9BCD95D24084F6F0B27C5ED._sub._googlecast._tcp.local. PTR (QM)? _googlecast._tcp.local. (94)
2018-01-26 02:05:03.050988 IP (tos 0x0, ttl 255, id 50634, offset 0, flags [DF], proto UDP (17), length 138)
    192.168.1.140.5353 > 224.0.0.251.5353: [udp sum ok] 19820 [3q] PTR (QM)? _%9E5E7C8F47989526C9BCD95D24084F6F0B27C5ED._sub._googlecast._tcp.local. PTR (QM)? _CA5E8412._sub._googlecast._tcp.local. PTR (QM)? _googlecast._tcp.local. (110)
2018-01-26 02:05:03.055365 IP (tos 0x0, ttl 255, id 50635, offset 0, flags [DF], proto UDP (17), length 154)
    192.168.1.140.5353 > 224.0.0.251.5353: [udp sum ok] 13919 [4q] PTR (QM)? _%9E5E7C8F47989526C9BCD95D24084F6F0B27C5ED._sub._googlecast._tcp.local. PTR (QM)? _CA5E8412._sub._googlecast._tcp.local. PTR (QM)? _9CB11073._sub._googlecast._tcp.local. PTR (QM)? _googlecast._tcp.local. (126)
2018-01-26 02:05:03.060993 IP (tos 0x0, ttl 255, id 50636, offset 0, flags [DF], proto UDP (17), length 138)
    192.168.1.140.5353 > 224.0.0.251.5353: [udp sum ok] 6167 [3q] PTR (QM)? _%9E5E7C8F47989526C9BCD95D24084F6F0B27C5ED._sub._googlecast._tcp.local. PTR (QM)? _CA5E8412._sub._googlecast._tcp.local. PTR (QM)? _googlecast._tcp.local. (110)
2018-01-26 02:05:03.066543 IP (tos 0x0, ttl 255, id 50637, offset 0, flags [DF], proto UDP (17), length 89)
    192.168.1.140.5353 > 224.0.0.251.5353: [udp sum ok] 8876 [2q] PTR (QM)? _9CB11073._sub._googlecast._tcp.local. PTR (QM)? _googlecast._tcp.local. (61)
2018-01-26 02:05:03.134065 IP (tos 0x0, ttl 255, id 50643, offset 0, flags [DF], proto UDP (17), length 122)
    192.168.1.140.5353 > 224.0.0.251.5353: [udp sum ok] 2695 [2q] PTR (QM)? _%9E5E7C8F47989526C9BCD95D24084F6F0B27C5ED._sub._googlecast._tcp.local. PTR (QM)? _googlecast._tcp.local. (94)
2018-01-26 02:05:03.143957 IP (tos 0x0, ttl 255, id 50644, offset 0, flags [DF], proto UDP (17), length 154)
    192.168.1.140.5353 > 224.0.0.251.5353: [udp sum ok] 14912 [4q] PTR (QM)? _37F83649._sub._googlecast._tcp.local. PTR (QM)? _%9E5E7C8F47989526C9BCD95D24084F6F0B27C5ED._sub._googlecast._tcp.local. PTR (QM)? _CA5E8412._sub._googlecast._tcp.local. PTR (QM)? _googlecast._tcp.local. (126)
2018-01-26 02:05:03.714073 IP (tos 0x0, ttl 255, id 50659, offset 0, flags [DF], proto UDP (17), length 89)
    192.168.1.140.5353 > 224.0.0.251.5353: [udp sum ok] 6 [2q] PTR (QM)? _37F83649._sub._googlecast._tcp.local. PTR (QM)? _googlecast._tcp.local. (61)
2018-01-26 02:05:03.715517 IP (tos 0x0, ttl 255, id 50660, offset 0, flags [DF], proto UDP (17), length 138)
    192.168.1.140.5353 > 224.0.0.251.5353: [udp sum ok] 6 [3q] PTR (QM)? _37F83649._sub._googlecast._tcp.local. PTR (QM)? _%9E5E7C8F47989526C9BCD95D24084F6F0B27C5ED._sub._googlecast._tcp.local. PTR (QM)? _googlecast._tcp.local. (110)
2018-01-26 02:05:04.030060 IP (tos 0x0, ttl 255, id 50690, offset 0, flags [DF], proto UDP (17), length 122)
    192.168.1.140.5353 > 224.0.0.251.5353: [udp sum ok] 4797 [2q] PTR (QM)? _%9E5E7C8F47989526C9BCD95D24084F6F0B27C5ED._sub._googlecast._tcp.local. PTR (QM)? _googlecast._tcp.local. (94)
2018-01-26 02:05:04.056589 IP (tos 0x0, ttl 255, id 50693, offset 0, flags [DF], proto UDP (17), length 138)
    192.168.1.140.5353 > 224.0.0.251.5353: [udp sum ok] 19821 [3q] PTR (QM)? _%9E5E7C8F47989526C9BCD95D24084F6F0B27C5ED._sub._googlecast._tcp.local. PTR (QM)? _CA5E8412._sub._googlecast._tcp.local. PTR (QM)? _googlecast._tcp.local. (110)
2018-01-26 02:05:04.060561 IP (tos 0x0, ttl 255, id 50694, offset 0, flags [DF], proto UDP (17), length 154)
    192.168.1.140.5353 > 224.0.0.251.5353: [udp sum ok] 13920 [4q] PTR (QM)? _%9E5E7C8F47989526C9BCD95D24084F6F0B27C5ED._sub._googlecast._tcp.local. PTR (QM)? _CA5E8412._sub._googlecast._tcp.local. PTR (QM)? _9CB11073._sub._googlecast._tcp.local. PTR (QM)? _googlecast._tcp.local. (126)
2018-01-26 02:05:04.064233 IP (tos 0x0, ttl 255, id 50695, offset 0, flags [DF], proto UDP (17), length 138)
    192.168.1.140.5353 > 224.0.0.251.5353: [udp sum ok] 6168 [3q] PTR (QM)? _%9E5E7C8F47989526C9BCD95D24084F6F0B27C5ED._sub._googlecast._tcp.local. PTR (QM)? _CA5E8412._sub._googlecast._tcp.local. PTR (QM)? _googlecast._tcp.local. (110)
2018-01-26 02:05:04.071243 IP (tos 0x0, ttl 255, id 50696, offset 0, flags [DF], proto UDP (17), length 89)
    192.168.1.140.5353 > 224.0.0.251.5353: [udp sum ok] 8877 [2q] PTR (QM)? _9CB11073._sub._googlecast._tcp.local. PTR (QM)? _googlecast._tcp.local. (61)
2018-01-26 02:05:04.136609 IP (tos 0x0, ttl 255, id 50698, offset 0, flags [DF], proto UDP (17), length 122)
    192.168.1.140.5353 > 224.0.0.251.5353: [udp sum ok] 2696 [2q] PTR (QM)? _%9E5E7C8F47989526C9BCD95D24084F6F0B27C5ED._sub._googlecast._tcp.local. PTR (QM)? _googlecast._tcp.local. (94)
2018-01-26 02:05:04.145295 IP (tos 0x0, ttl 255, id 50699, offset 0, flags [DF], proto UDP (17), length 154)
    192.168.1.140.5353 > 224.0.0.251.5353: [udp sum ok] 14913 [4q] PTR (QM)? _37F83649._sub._googlecast._tcp.local. PTR (QM)? _%9E5E7C8F47989526C9BCD95D24084F6F0B27C5ED._sub._googlecast._tcp.local. PTR (QM)? _CA5E8412._sub._googlecast._tcp.local. PTR (QM)? _googlecast._tcp.local. (126)
^C
67 packets captured
165 packets received by filter
98 packets dropped by kernel
`

**Comment by yuhhaurlin** [comment]
Thanks for your information.

**Comment by yuhhaurlin** [comment]
@Alexander-r Please help to check if https://github.com/kaloz/mwlwifi/commit/2b99e150f954944d17607004416e1f2321a73510 fixes your problem. If you still have problem, I will check QA to reproduce the problem. Thanks.

**Comment by Alexander-r** [comment]
@yuhhaurlin Yes the problem affects all firmwares with LEDE

I've tested 2b99e15 and it does not fix the problem. The phone still disconnects.

The problem is related to recent fix from Google.
At the start of the tests I had Google Play services 8.6.22-all [0] [PR] 179647274 installed on the phone. Right now I've installed version 8.7.10-all [0] [PR] 18179946. With this version with broadcast '1' the phone connects immediately but it disconnects after a couple of seconds as before. With unicast replies it takes longer to connect (it's stuck on "Obtaining IP address" for about a minute) but after that it no longer disconnects.
It seems that router has problems sending broadcast traffic right after connection but after some time everything works normally.

**Comment by yuhhaurlin** [comment]
Can you show me the log? Thanks.

**Comment by yuhhaurlin** [comment]
BTW, can you cat ampdu when the phone wait for IP.

**Comment by bbogey** [comment]
@Alexander-r those versions seems to point to Google Play _Store_.
Did you check version and do upgrade for Google Play service?

**Comment by spamtree** [comment]
I wonder if there are different versions of google play services for nougat and oreo. 
I have nougat the google play services on both my phones is 
version 11.9.51 (440-177350961) 
com.google.android.gms

**Comment by bbogey** [comment]
I have the exact same version in Oreo. That @Alexander-r version was for Store what has nothing to do with this.

**Comment by spamtree** [comment]
Sorry about that.

**Comment by Alexander-r** [comment]
@yuhhaurlin Right now Google Play Services is 11.9.75 (948-182402865). Before the update the version was 11.9.51 (948-177350961) (that's according to the backup I did before upgrade).

Right now I don't have access to the device. I will be able to do more tests and provide logs on Monday. Do you want the logs for normal connection or for one with broadcast '1'?

**Comment by yuhhaurlin** [comment]
1. It looks like your problem is not related to broadcast.
2. The phone will ask unicast reply.
3. Please do unicast and get log. I need to know if it is the same as before the phone can't get unicast reply.
4. You told me that it takes one minute to get IP address for the phone under unicast reply. Please cat ampdu when the phone try to get the IP address.

Thanks.

**Comment by bg4drl** [comment]
Android three devices Home Max, Pixel 2 xl, Pixelbook2 using Google cast, Intel 9260 also connected in this wifi network to go 1733Mbps. VHT160SGI drive has been used for two days Crush, restart WRT3200, Channel will not up, Flash WRT3200, turn on VHT80 to see how long
pixel 2 xl ‘s google play beta 51 is installed.

**Comment by yuhhaurlin** [comment]
We found 160MHz throughput problem with 9260. We work for It now.

**Comment by Alexander-r** [comment]
@yuhhaurlin Here is the log for unicast dhcp:
```
Mon Jan 29 19:49:04 2018 daemon.info hostapd: wlan0: STA c0:ee:fb:46:7a:24 IEEE 802.11: associated (aid 3)
Mon Jan 29 19:49:04 2018 daemon.notice hostapd: wlan0: AP-STA-CONNECTED c0:ee:fb:46:7a:24
Mon Jan 29 19:49:04 2018 daemon.info hostapd: wlan0: STA c0:ee:fb:46:7a:24 RADIUS: starting accounting session 97E69C0C532B586F
Mon Jan 29 19:49:04 2018 daemon.info hostapd: wlan0: STA c0:ee:fb:46:7a:24 WPA: pairwise key handshake completed (RSN)
Mon Jan 29 19:49:04 2018 daemon.info dnsmasq-dhcp[7315]: DHCPDISCOVER(br-lan) c0:ee:fb:46:7a:24
Mon Jan 29 19:49:04 2018 daemon.info dnsmasq-dhcp[7315]: DHCPOFFER(br-lan) 192.168.7.10 c0:ee:fb:46:7a:24
Mon Jan 29 19:49:05 2018 daemon.info hostapd: wlan0: STA c0:ee:fb:46:7a:24 IEEE 802.11: authenticated
Mon Jan 29 19:49:09 2018 daemon.info dnsmasq-dhcp[7315]: DHCPDISCOVER(br-lan) c0:ee:fb:46:7a:24
Mon Jan 29 19:49:09 2018 daemon.info dnsmasq-dhcp[7315]: DHCPOFFER(br-lan) 192.168.7.10 c0:ee:fb:46:7a:24
Mon Jan 29 19:49:14 2018 daemon.info dnsmasq-dhcp[7315]: DHCPDISCOVER(br-lan) c0:ee:fb:46:7a:24
Mon Jan 29 19:49:14 2018 daemon.info dnsmasq-dhcp[7315]: DHCPOFFER(br-lan) 192.168.7.10 c0:ee:fb:46:7a:24
Mon Jan 29 19:49:22 2018 daemon.info dnsmasq-dhcp[7315]: DHCPDISCOVER(br-lan) c0:ee:fb:46:7a:24
Mon Jan 29 19:49:22 2018 daemon.info dnsmasq-dhcp[7315]: DHCPOFFER(br-lan) 192.168.7.10 c0:ee:fb:46:7a:24
Mon Jan 29 19:49:38 2018 daemon.info dnsmasq-dhcp[7315]: DHCPDISCOVER(br-lan) c0:ee:fb:46:7a:24
Mon Jan 29 19:49:38 2018 daemon.info dnsmasq-dhcp[7315]: DHCPOFFER(br-lan) 192.168.7.10 c0:ee:fb:46:7a:24
Mon Jan 29 19:49:40 2018 daemon.notice hostapd: wlan0: AP-STA-DISCONNECTED c0:ee:fb:46:7a:24
Mon Jan 29 19:49:40 2018 kern.debug kernel: [249398.921884] ieee80211 phy0: staid 3 deleted
Mon Jan 29 19:49:42 2018 daemon.info hostapd: wlan0: STA c0:ee:fb:46:7a:24 IEEE 802.11: associated (aid 3)
Mon Jan 29 19:49:42 2018 daemon.notice hostapd: wlan0: AP-STA-CONNECTED c0:ee:fb:46:7a:24
Mon Jan 29 19:49:42 2018 daemon.info hostapd: wlan0: STA c0:ee:fb:46:7a:24 RADIUS: starting accounting session 562F499DE13D21FC
Mon Jan 29 19:49:42 2018 daemon.info hostapd: wlan0: STA c0:ee:fb:46:7a:24 WPA: pairwise key handshake completed (RSN)
Mon Jan 29 19:49:42 2018 daemon.info dnsmasq-dhcp[7315]: DHCPDISCOVER(br-lan) c0:ee:fb:46:7a:24
Mon Jan 29 19:49:42 2018 daemon.info dnsmasq-dhcp[7315]: DHCPOFFER(br-lan) 192.168.7.10 c0:ee:fb:46:7a:24
Mon Jan 29 19:49:47 2018 daemon.info dnsmasq-dhcp[7315]: DHCPDISCOVER(br-lan) c0:ee:fb:46:7a:24
Mon Jan 29 19:49:47 2018 daemon.info dnsmasq-dhcp[7315]: DHCPOFFER(br-lan) 192.168.7.10 c0:ee:fb:46:7a:24
Mon Jan 29 19:49:52 2018 daemon.info dnsmasq-dhcp[7315]: DHCPDISCOVER(br-lan) c0:ee:fb:46:7a:24
Mon Jan 29 19:49:52 2018 daemon.info dnsmasq-dhcp[7315]: DHCPOFFER(br-lan) 192.168.7.10 c0:ee:fb:46:7a:24
Mon Jan 29 19:49:58 2018 daemon.info hostapd: wlan0: STA c0:ee:fb:46:7a:24 IEEE 802.11: authenticated
Mon Jan 29 19:50:00 2018 daemon.info dnsmasq-dhcp[7315]: DHCPDISCOVER(br-lan) c0:ee:fb:46:7a:24
Mon Jan 29 19:50:00 2018 daemon.info dnsmasq-dhcp[7315]: DHCPOFFER(br-lan) 192.168.7.10 c0:ee:fb:46:7a:24
Mon Jan 29 19:50:15 2018 daemon.info dnsmasq-dhcp[7315]: DHCPDISCOVER(br-lan) c0:ee:fb:46:7a:24
Mon Jan 29 19:50:15 2018 daemon.info dnsmasq-dhcp[7315]: DHCPOFFER(br-lan) 192.168.7.10 c0:ee:fb:46:7a:24
Mon Jan 29 19:50:15 2018 daemon.info dnsmasq-dhcp[7315]: DHCPREQUEST(br-lan) 192.168.7.10 c0:ee:fb:46:7a:24
Mon Jan 29 19:50:15 2018 daemon.info dnsmasq-dhcp[7315]: DHCPACK(br-lan) 192.168.7.10 c0:ee:fb:46:7a:24 OnePlus2
```

And here is ampdu while phone waits for IP address:
```
stream: 6
idx: 6
state: 3
mac address: c0:ee:fb:46:7a:24
tid: 6
```

**Comment by yuhhaurlin** [comment]
Thanks. Can you also cat stnid for me?

**Comment by yuhhaurlin** [comment]
@Alexander-r Please help to verify https://github.com/kaloz/mwlwifi/commit/adae20af0ddac061807fbaadec6c3b8129290480. Thanks.

**Comment by Alexander-r** [comment]
I've tried adae20a. It has same problems.
Here is stnid output:
```
stnid: 1 macid: 0 aid: 1
stnid: 2 macid: 0 aid: 2
```

**Comment by yuhhaurlin** [comment]
It is very strange, I will try to reproduce the problem here.

**Comment by yuhhaurlin** [comment]
I hope I can collect Andriod phone which has this issue:
OnePlus 2
Sony Xperia X Performance

Please let me know if other Andriod phone has this issue.

Samsung S6 edge does not have this issue.

**Comment by adamcarter1** [comment]
I have a feeling today's the day this gets fixed.

**Comment by adamcarter1** [comment]
<a href="https://imgflip.com/i/23wplv"><img src="https://i.imgflip.com/23wplv.jpg" title="made at imgflip.com"/></a>

**Comment by yuhhaurlin** [comment]
Please only report problems here.

**Comment by yuhhaurlin** [comment]
BTW, can I know what the problem you have? The same issue here, what kind of Android phone?

**Comment by adamcarter1** [comment]
Vizio android tv with smartcast. M65-E0. Basically a glorrified chromecast.

I know google is working on their end. Linksys sent out an email saying they are working on it on their end.

**Comment by adamcarter1** [comment]
I use dd-wrt. Couldnt test ur builds even if i wanted to.

**Comment by Keltere** [comment]
Same problem here: with xiaomi mi5 and huawei p10 i can't connect to 5ghz and i have a very bad performance (30MB/s and disconnection) with usb wifi card Realtek 8812au. This is really a mess...
I've tried the new stock firmware and the new davidc502 firmware with lede and wifi driver 10.3.4.0-20180118

**Comment by yuhhaurlin** [comment]
Please let me know your setting.

**Comment by yuhhaurlin** [comment]
Issue here is some Android phones take time to connect and I did not hear low throughput problem.

**Comment by Keltere** [comment]
@yuhhaurlin what settings? Wifi settings? I've tried channel 1-6-10-11, all width settings (20,40,80), and of course all auto. Same problem.

**Comment by aaron1959** [comment]
With this driver and firmware dd-wrt is working fine with android clients including android Galaxy S7.
driver version: 10.3.4.0-20180118
firmware version: 0x09030204

**Comment by yuhhaurlin** [comment]
@aaron1959 Yes. Same result as we test here.

**Comment by yuhhaurlin** [comment]
@Keltete Can you cat /etc/config/wireless for me?

**Comment by Alexander-r** [comment]
I had been seeing a lot of messages like this in the logs for different devices on the network:
```
Wed Feb  7 22:42:45 2018 daemon.info hostapd: wlan0: STA c0:ee:fb:46:7a:24 IEEE 802.11: disassociated due to inactivity
Wed Feb  7 22:42:46 2018 daemon.info hostapd: wlan0: STA c0:ee:fb:46:7a:24 IEEE 802.11: deauthenticated due to inactivity (timer DEAUTH/REMOVE)
```
So there might be disconnects.

Disconnects like this should only happen if there is no traffic from the device for a long time. But sometimes I notice network hanging for a couple of seconds so maybe this disconnects happen then. It's hard to track when this happens.
And from what I see during inactivity before disconnecting the device the router should send empty data frame and if the clients sends ACK for it it should not be disconnected. So normally this disconnects should not happen.

But the throughput is usually fine.

@Keltere 1-6-10-11 are 2.4GHz channels. For me 2.4GHz works without any problems. I only have problems on 5GHz.

**Comment by aaron1959** [comment]
Turning on and off android S7 I get this log response it seems to function quickly and normally.

Feb  7 23:31:21 DD-WRT kern.debug kernel: [27310.276394] ieee80211 phy0: staid 1 deleted
--
Feb  7 23:31:22 DD-WRT daemon.info hostapd: ath0: STA  8c:f5:a3:4f:7f:3c IEEE 802.11: deauthenticated due to inactivity (timer  DEAUTH/REMOVE)
Feb  7 23:31:59 DD-WRT daemon.info hostapd: ath0: STA 8c:f5:a3:4f:7f:3c MLME: auth request, signal 0 (Accepted)
Feb  7 23:31:59 DD-WRT daemon.info hostapd: ath0: STA 8c:f5:a3:4f:7f:3c MLME: assoc request, signal 0 (Accepted)
Feb  7 23:31:59 DD-WRT daemon.info hostapd: ath0: STA 8c:f5:a3:4f:7f:3c IEEE 802.11: associated (aid 1)
Feb  7 23:31:59 DD-WRT daemon.info hostapd: ath0: STA 8c:f5:a3:4f:7f:3c RADIUS: starting accounting session 5FD7D092BC78FCEB
Feb  7 23:32:00 DD-WRT daemon.info hostapd: ath0: STA 8c:f5:a3:4f:7f:3c IEEE 802.11: authenticated

**Comment by yuhhaurlin** [comment]
Sorry. Due to limitation of firmware, NULL packet query from hostapd will not work. The connection will be gone for this case. However the connection will be established once if client is back.

**Comment by aaron1959** [comment]
reconnect takes less then 8oo ms.

**Comment by yuhhaurlin** [comment]
From my log, the remaining problem are connect takes time for some Andriod devices and reconnect problem reported in another issue. I will fix them later.

**Comment by yuhhaurlin** [comment]
@aaron1959  Yes. User should not notice reconnection in normal case.

**Comment by Alexander-r** [comment]
A bit more logs:
```
Wed Feb  7 23:09:59 2018 daemon.notice hostapd: wlan0: AP-STA-DISCONNECTED 9c:5c:f9:2e:b4:8c
Wed Feb  7 23:09:59 2018 daemon.info hostapd: wlan0: STA 9c:5c:f9:2e:b4:8c IEEE 802.11: disassociated due to inactivity
Wed Feb  7 23:10:00 2018 daemon.info hostapd: wlan0: STA 9c:5c:f9:2e:b4:8c IEEE 802.11: deauthenticated due to inactivity (timer DEAUTH/REMOVE)
Wed Feb  7 23:10:00 2018 kern.debug kernel: [730276.936242] ieee80211 phy0: staid 3 deleted
Wed Feb  7 23:10:05 2018 daemon.info hostapd: wlan0: STA 9c:5c:f9:2e:b4:8c IEEE 802.11: associated (aid 3)
Wed Feb  7 23:10:05 2018 daemon.notice hostapd: wlan0: AP-STA-CONNECTED 9c:5c:f9:2e:b4:8c
Wed Feb  7 23:10:05 2018 daemon.info hostapd: wlan0: STA 9c:5c:f9:2e:b4:8c RADIUS: starting accounting session EF7CB375244C000E
Wed Feb  7 23:10:05 2018 daemon.info hostapd: wlan0: STA 9c:5c:f9:2e:b4:8c WPA: pairwise key handshake completed (RSN)
Wed Feb  7 23:10:07 2018 daemon.info hostapd: wlan0: STA 9c:5c:f9:2e:b4:8c IEEE 802.11: authenticated
Wed Feb  7 23:19:42 2018 daemon.notice hostapd: wlan0: AP-STA-DISCONNECTED 9c:5c:f9:2e:b4:8c
Wed Feb  7 23:19:42 2018 daemon.info hostapd: wlan0: STA 9c:5c:f9:2e:b4:8c IEEE 802.11: disassociated due to inactivity
Wed Feb  7 23:19:43 2018 daemon.info hostapd: wlan0: STA 9c:5c:f9:2e:b4:8c IEEE 802.11: deauthenticated due to inactivity (timer DEAUTH/REMOVE)
Wed Feb  7 23:19:43 2018 kern.debug kernel: [730859.663876] ieee80211 phy0: staid 3 deleted
Wed Feb  7 23:19:47 2018 daemon.info hostapd: wlan0: STA 9c:5c:f9:2e:b4:8c IEEE 802.11: associated (aid 3)
Wed Feb  7 23:19:47 2018 daemon.notice hostapd: wlan0: AP-STA-CONNECTED 9c:5c:f9:2e:b4:8c
```

9c:5c:f9:2e:b4:8c here is my PC. From the logs It has been disconnecting like this for as long as I see exactly every 10 minutes. And for example for the last hour I'm sure there was a lot of traffic from it so it should hat have been disconnection like this. Or at least this should not have been happening every 10 minutes.
Reconnects here are fast. But this disconnects here happen even if the client is transmitting something and they interrupt the network. Even fast reconnects will be noticeable during downloads or in online games.

On the router uptime is a bit more then 8 days. Don't know if that has anything to do with this. And I had not payed attention to this messages before so I don't know when exactly this has started.

Should I open a separate issue for this?

And isn't not being able to send empty data packet a bug by itself?

**Comment by yuhhaurlin** [comment]
The message shows no activity and it happens every 10 minutes (600 seconds) which is default age time. The behavior is correct. The limitation of firmware is that it can't give ACK of NULL packet immediately. It will not affect normal operation.

**Comment by AjkayAlan** [comment]
To back up @aaron1959, I have not been able to replicate the issue in my setup. Moto X4 running Android 8.0 December 1st Security patch connects quickly on both 2.4GHz and 5GHz and in general I haven't had any issues besides the occasional mDNS issue from my Chromecast before Google pushed an update. Additionally I can play a video game or stream something continuously without interruption so I am not getting dropped from what I can tell.

driver version: 10.3.4.0-20180118
firmware version: 0x09030204
Kernel version: 4.9.77 
Build: LEDE r5917 (davidc502)
Setup:
 -DNS set to ignore DNS advertised by peer and set to Google DNS for both WAN (IPv4) and WAN6 (IPv6) interfaces
 -2.4GHz set to 40MHz on channel 6
 -5GHz set to 80MHz on channel 153
 -cron schedule to restart router every day at 4:30AM

**Comment by Keltere** [comment]
@Alexander-r yup, sry my bad i was really tired.

@yuhhaurlin here it is my config

```
config wifi-device 'radio0'
        option type 'mac80211'
        option hwmode '11a'
        option path 'soc/soc:pcie-controller/pci0000:00/0000:00:01.0/0000:01:00.0'
        option htmode 'VHT80'
        option country '00'
        option channel '48'
        option legacy_rates '0'

config wifi-iface 'default_radio0'
        option device 'radio0'
        option network 'lan'
        option mode 'ap'
        option ssid 'Wifi-Casa_5G'
        option key 'password'
        option encryption 'psk2+ccmp'

config wifi-device 'radio1'
        option type 'mac80211'
        option channel '11'
        option hwmode '11g'
        option path 'soc/soc:pcie-controller/pci0000:00/0000:00:02.0/0000:02:00.0'
        option htmode 'HT20'
        option country '00'
        option legacy_rates '0'

config wifi-iface 'default_radio1'
        option device 'radio1'
        option network 'lan'
        option mode 'ap'
        option ssid 'Wifi-Casa'
        option encryption 'psk2'
        option key 'password'

config wifi-device 'radio2'
        option type 'mac80211'
        option channel '36'
        option hwmode '11a'
        option path 'platform/soc/soc:internal-regs/f10d8000.sdhci/mmc_host/mmc0/mmc0:0001/mmc0:0001:1'
        option htmode 'VHT80'

config wifi-iface 'default_radio2'
        option device 'radio2'
        option network 'lan'
        option mode 'ap'
        option ssid 'OpenWrt'
        option encryption 'none'
        option disabled '1'

```
I've tried also last Davidc502 build but same problem: can't connect to the first 5ghz, the second isn't working, on pc with wifi i get max 30MBps with drops.

**Comment by yuhhaurlin** [comment]
1. Radio 2 is not mwlwifi.
2. Please remove country and legacy_rates.
3. Please only use CCMP for radio1.

**Comment by Keltere** [comment]
@yuhhaurlin ok, i did a "wifi config" and i set as you said. Nothing change and i still have the cap a 30MB/s

```
config wifi-device 'radio0'
        option type 'mac80211'
        option channel '36'
        option hwmode '11a'
        option path 'soc/soc:pcie-controller/pci0000:00/0000:00:01.0/0000:01:00.0'
        option htmode 'VHT80'

config wifi-iface 'default_radio0'
        option device 'radio0'
        option network 'lan'
        option mode 'ap'
        option ssid 'Wifi-Casa_5G'
        option encryption 'psk2+ccmp'
        option key 'Password'

config wifi-device 'radio1'
        option type 'mac80211'
        option channel '11'
        option hwmode '11g'
        option path 'soc/soc:pcie-controller/pci0000:00/0000:00:02.0/0000:02:00.0'
        option htmode 'HT20'

config wifi-iface 'default_radio1'
        option device 'radio1'
        option network 'lan'
        option mode 'ap'
        option ssid 'Wifi-Casa'
        option encryption 'psk2+ccmp'
        option key 'Password'
```

**Comment by yuhhaurlin** [comment]
Can you do iperf test from router to PC? BTW, did you still encounter connection drop?

**Comment by Keltere** [comment]
@yuhhaurlin this?

```
Client connecting to 192.168.1.115, TCP port 5201
TCP window size: 43.8 KByte (default)
------------------------------------------------------------
[  3] local 192.168.1.1 port 34350 connected with 192.168.1.115 port 5201
[ ID] Interval       Transfer     Bandwidth
[  3]  0.0- 1.0 sec  27.0 MBytes   226 Mbits/sec
[  3]  1.0- 2.0 sec  27.6 MBytes   232 Mbits/sec
[  3]  2.0- 3.0 sec  29.5 MBytes   247 Mbits/sec
[  3]  3.0- 4.0 sec  27.0 MBytes   226 Mbits/sec
[  3]  4.0- 5.0 sec  28.8 MBytes   241 Mbits/sec
[  3]  5.0- 6.0 sec  28.4 MBytes   238 Mbits/sec
[  3]  6.0- 7.0 sec  27.4 MBytes   230 Mbits/sec
[  3]  7.0- 8.0 sec  28.8 MBytes   241 Mbits/sec
[  3]  8.0- 9.0 sec  26.5 MBytes   222 Mbits/sec
[  3]  9.0-10.0 sec  28.2 MBytes   237 Mbits/sec
[  3]  0.0-10.0 sec   279 MBytes   234 Mbits/sec

```

**Comment by yuhhaurlin** [comment]
The throughput is not bad. What do you mean connect drop?

**Comment by yuhhaurlin** [comment]
Can I know the capability of your client? Or you can cat /sys/kernel/debug/ieee80211/phy0/sta?

**Comment by Keltere** [comment]
Here i am, sorry for the delay.
I've resolved the connection drop by installing again the driver but that cause a loss of 10mbps. I willl make more tests to check if it's something relate to my wifi doongle or not.
I use NETIS WF2190 (realtek 8812au) with usb 3.0 in the specs it's write 867Mbps max.

Here it is the output of `cat /sys/kernel/debug/ieee80211/phy0/mwlwifi/sta`

```
mac address: e4:be:ed:05:d3:08
aid: 1
ampdu: true
amsdu: false
wds: false
ht_cap: 0x086e, ampdu: 03, 00
rx_mask: 0xff, ff, 00, 00
vht_cap: 0x33c030a0, mcs: fffa, fffa
rx_bw: 2, rx_nss: 2
tdls: 0, tdls_init: 0
wme: 1, mfp: 0
IV: 000000000001
```

**Comment by yuhhaurlin** [comment]
Your client is 2x2 without AMSDU.

**Comment by yuhhaurlin** [comment]
Please check http://www.dell.com/support/article/tw/en/twdhs1/qna43752/80211ac-data-rates-vs-tcp-throughput?lang=en.
If your USB is 2.0, please check https://superuser.com/questions/317217/whats-the-maximum-typical-speed-possible-with-a-usb2-0-drive.

**Comment by yuhhaurlin** [comment]
Sorry. You already said it is USB 3.0. Can I know what is the speed you got with other AP?

**Comment by yuhhaurlin** [comment]
You also need to check if the USB of your PC is 3.0.

**Comment by Keltere** [comment]
With the old modem i was getting almost 30MB/s but with 2.4g and wifi n. I will go and buy another wifi card and test if i get the same performance.
I have no usb 2.0 just 3.1.
I have a GA-AX370-Gaming K7 motherboard.

**Comment by Keltere** [comment]
@yuhhaurlin hi, sorry for the delay but i've changed the wifi usb card and now i get a better connection with 300mbps. Is this the maximus throughput of the router?

the new one is a tp-link archer t9uh
```
mac address: 50:3e:aa:3f:6e:22
aid: 1
ampdu: true
amsdu: false
wds: false
ht_cap: 0x086f, ampdu: 03, 00
rx_mask: 0xff, ff, ff, 00
vht_cap: 0x03c258b0, mcs: ffea, ffea
rx_bw: 2, rx_nss: 3
tdls: 0, tdls_init: 0
wme: 1, mfp: 0
IV: 000000000001
```

**Comment by yuhhaurlin** [comment]
The client is 3x3 without AMSDU. I don't know if there is any limit for the USB interface. The throughput is different from client to client and the environment you tested.

**Comment by andyVSR** [comment]
@yuhhaurlin : are you still working on this issue ? with old builds/firmware i didnt have this happening. my android phones takes too long to connect and choose to connect to other networks within my area which are saved in the phone and i dont want to. i also dont want to delete other saved networks from phones :)

driver name: mwlwifi
chip type: 88W8964
hw version: 7
driver version: 10.3.4.0-20180118
firmware version: 0x09030204

**Comment by yuhhaurlin** [comment]
Can you let me know the phone you used and which version is all right for it? Only one phone or many phones have problem.

**Comment by andyVSR** [comment]
samsung galaxy s2 and s3. i dont remeber the version of driver/firmare (i use ddwrt), but was ok in november/december 2017.

**Comment by yuhhaurlin** [comment]
Thanks.

**Comment by yuhhaurlin** [comment]
Can you help to test following OpenWrt image and get log for me?

Factory: https://drive.google.com/open?id=1CtUWjBGjqYl1oMpUBsqATEWOlI4_U0G4
Upgrade: https://drive.google.com/open?id=15SsZhBhKNkt4kfeiTuhxkAf9VKeiLMFc

Once if AP is up, please use following way to capture DHCP packets:

iw wlan0 interface add mon0 type monitor
iw mon0 up
tcpdump -i mon0 -vvv -n port 67 and port 68

If you use wlan1, you need to replace wlan0 with wlan1.

**Comment by yuhhaurlin** [comment]
Please test with open mode without security, so tcpdump can dump DHCP packets. Thanks.

**Comment by andyVSR** [comment]
Ok. i will test it these days.

**Comment by andyVSR** [comment]
@yuhhaurlin : "iw mon0 up" , is not working. did you mean "ifconfig mon0 up" ?

**Comment by andyVSR** [comment]
the issue is only present for wlan0 (5ghz). for 2.4ghz is working properly with immediate connect.
 i cant capture any logs for wlan0 since on the phone the OpenWrt network stays "not in range" for about 10sec and then is available, but in the meanwhile the phone choose to connect to a lower priority network.
 once the 5ghz OpenWrt network is available on the phone, if i choose to connect, then it do it quickly :

tcpdump: listening on mon0, link-type IEEE802_11_RADIO (802.11 plus radiotap header), capture size 262144 bytes
12:10:40.056271 5180 MHz 11n -73dBm signal antenna 0 65.0 Mb/s MCS 7 20 MHz long GI IP (tos 0x0, ttl 64, id 48700, offset 0, flags [none], proto UDP (17), length 337)
    0.0.0.0.68 > 255.255.255.255.67: [udp sum ok] BOOTP/DHCP, Request from 98:0c:82:85:d9:ec, length 309, xid 0xff6bb7d0, Flags [none] (0x0000)
          Client-Ethernet-Address 98:0c:82:85:d9:ec
          Vendor-rfc1048 Extensions
            Magic Cookie 0x63825363
            DHCP-Message Option 53, length 1: Discover
            Client-ID Option 61, length 7: ether 98:0c:82:85:d9:ec
            MSZ Option 57, length 2: 1500
            Vendor-Class Option 60, length 13: "dhcpcd-5.2.10"
            Hostname Option 12, length 24: "android-8f37aef02265dbcb"
            Parameter-Request Option 55, length 9:
              Subnet-Mask, Static-Route, Default-Gateway, Domain-Name-Server
              Domain-Name, BR, Lease-Time, RN
              RB
            END Option 255, length 0
12:10:40.057526 6.0 Mb/s [bit 15] IP (tos 0xc0, ttl 64, id 33883, offset 0, flags [none], proto UDP (17), length 328)
    192.168.1.1.67 > 192.168.1.194.68: [udp sum ok] BOOTP/DHCP, Reply, length 300, xid 0xff6bb7d0, Flags [none] (0x0000)
          Your-IP 192.168.1.194
          Server-IP 192.168.1.1
          Client-Ethernet-Address 98:0c:82:85:d9:ec
          Vendor-rfc1048 Extensions
            Magic Cookie 0x63825363
            DHCP-Message Option 53, length 1: Offer
            Server-ID Option 54, length 4: 192.168.1.1
            Lease-Time Option 51, length 4: 43200
            RN Option 58, length 4: 21600
            RB Option 59, length 4: 37800
            Subnet-Mask Option 1, length 4: 255.255.255.0
            BR Option 28, length 4: 192.168.1.255
            Default-Gateway Option 3, length 4: 192.168.1.1
            Domain-Name-Server Option 6, length 4: 192.168.1.1
            Domain-Name Option 15, length 3: "lan"
            END Option 255, length 0
            PAD Option 0, length 0, occurs 3
12:10:40.059921 5180 MHz 11n -73dBm signal antenna 0 65.0 Mb/s MCS 7 20 MHz long GI IP (tos 0x0, ttl 64, id 63075, offset 0, flags [none], proto UDP (17), length 349)
    0.0.0.0.68 > 255.255.255.255.67: [udp sum ok] BOOTP/DHCP, Request from 98:0c:82:85:d9:ec, length 321, xid 0xff6bb7d0, Flags [none] (0x0000)
          Client-Ethernet-Address 98:0c:82:85:d9:ec
          Vendor-rfc1048 Extensions
            Magic Cookie 0x63825363
            DHCP-Message Option 53, length 1: Request
            Client-ID Option 61, length 7: ether 98:0c:82:85:d9:ec
            Requested-IP Option 50, length 4: 192.168.1.194
            Server-ID Option 54, length 4: 192.168.1.1
            MSZ Option 57, length 2: 1500
            Vendor-Class Option 60, length 13: "dhcpcd-5.2.10"
            Hostname Option 12, length 24: "android-8f37aef02265dbcb"
            Parameter-Request Option 55, length 9:
              Subnet-Mask, Static-Route, Default-Gateway, Domain-Name-Server
              Domain-Name, BR, Lease-Time, RN
              RB
            END Option 255, length 0
12:10:40.061135 6.0 Mb/s [bit 15] IP (tos 0xc0, ttl 64, id 33884, offset 0, flags [none], proto UDP (17), length 328)
    192.168.1.1.67 > 192.168.1.194.68: [udp sum ok] BOOTP/DHCP, Reply, length 300, xid 0xff6bb7d0, Flags [none] (0x0000)
          Your-IP 192.168.1.194
          Server-IP 192.168.1.1
          Client-Ethernet-Address 98:0c:82:85:d9:ec
          Vendor-rfc1048 Extensions
            Magic Cookie 0x63825363
            DHCP-Message Option 53, length 1: ACK
            Server-ID Option 54, length 4: 192.168.1.1
            Lease-Time Option 51, length 4: 43200
            RN Option 58, length 4: 21600
            RB Option 59, length 4: 37800
            Subnet-Mask Option 1, length 4: 255.255.255.0
            BR Option 28, length 4: 192.168.1.255
            Default-Gateway Option 3, length 4: 192.168.1.1
            Domain-Name-Server Option 6, length 4: 192.168.1.1
            Domain-Name Option 15, length 3: "lan"
            END Option 255, length 0
            PAD Option 0, length 0, occurs 3

**Comment by andyVSR** [comment]
Ok. I captured this log while turning on wifi on the phone and it choose another network, although the highest priority network is OpenWrt (5ghz) :

root@OpenWrt:/#  tcpdump -i wlan0 -v
tcpdump: listening on wlan0, link-type EN10MB (Ethernet), capture size 262144 bytes
13:08:16.283181 98:0c:82:85:d9:ec (oui Unknown) > Broadcast Null Unnumbered, xid, Flags [Response], length 6: 01 00
13:08:16.647566 IP (tos 0x0, ttl 64, id 12004, offset 0, flags [none], proto UDP (17), length 337)
    0.0.0.0.68 > 255.255.255.255.67: BOOTP/DHCP, Request from 98:0c:82:85:d9:ec (oui Unknown), length 309, xid 0x57596fae, Flags [none]
          Client-Ethernet-Address 98:0c:82:85:d9:ec (oui Unknown)
          Vendor-rfc1048 Extensions
            Magic Cookie 0x63825363
            DHCP-Message Option 53, length 1: Discover
            Client-ID Option 61, length 7: ether 98:0c:82:85:d9:ec
            MSZ Option 57, length 2: 1500
            Vendor-Class Option 60, length 13: "dhcpcd-5.2.10"
            Hostname Option 12, length 24: "android-8f37aef02265dbcb"
            Parameter-Request Option 55, length 9:
              Subnet-Mask, Static-Route, Default-Gateway, Domain-Name-Server
              Domain-Name, BR, Lease-Time, RN
              RB
13:08:16.653149 IP (tos 0x0, ttl 64, id 10178, offset 0, flags [none], proto UDP (17), length 349)
    0.0.0.0.68 > 255.255.255.255.67: BOOTP/DHCP, Request from 98:0c:82:85:d9:ec (oui Unknown), length 321, xid 0x57596fae, Flags [none]
          Client-Ethernet-Address 98:0c:82:85:d9:ec (oui Unknown)
          Vendor-rfc1048 Extensions
            Magic Cookie 0x63825363
            DHCP-Message Option 53, length 1: Request
            Client-ID Option 61, length 7: ether 98:0c:82:85:d9:ec
            Requested-IP Option 50, length 4: android-8f37aef02265dbcb.lan
            Server-ID Option 54, length 4: OpenWrt.lan
            MSZ Option 57, length 2: 1500
            Vendor-Class Option 60, length 13: "dhcpcd-5.2.10"
            Hostname Option 12, length 24: "android-8f37aef02265dbcb"
            Parameter-Request Option 55, length 9:
              Subnet-Mask, Static-Route, Default-Gateway, Domain-Name-Server
              Domain-Name, BR, Lease-Time, RN
              RB
13:08:17.540168 ARP, Ethernet (len 6), IPv4 (len 4), Request who-has OpenWrt.lan tell android-8f37aef02265dbcb.lan, length 28
13:08:19.211795 IP6 (hlim 1, next-header Options (0) payload length: 36) fe80::9a0c:82ff:fe85:d9ec > ff02::16: HBH (rtalert: 0x0000) (padn) [icmp6 sum ok] ICMP6, multicast listener report v2, 1 group record(s) [gaddr ff02::1:ff85:d9ec to_ex, 0 source(s)]
13:08:20.458112 IP6 (hlim 255, next-header ICMPv6 (58) payload length: 16) fe80::9a0c:82ff:fe85:d9ec > ip6-allrouters: [icmp6 sum ok] ICMP6, router solicitation, length 16
          source link-address option (1), length 8 (1): 98:0c:82:85:d9:ec
13:08:20.471842 IP6 (hlim 1, next-header Options (0) payload length: 36) fe80::9a0c:82ff:fe85:d9ec > ff02::16: HBH (rtalert: 0x0000) (padn) [icmp6 sum ok] ICMP6, multicast listener report v2, 1 group record(s) [gaddr ff02::1:ffc4:8dff to_ex, 0 source(s)]
13:08:20.880305 IP6 (hlim 255, next-header ICMPv6 (58) payload length: 24) :: > ff02::1:ffc4:8dff: [icmp6 sum ok] ICMP6, neighbor solicitation, length 24, who has fd62:cf7d:2671::816f:22ce:a8c4:8dff
13:08:21.126816 IP6 (hlim 255, next-header ICMPv6 (58) payload length: 24) :: > ff02::1:ff85:d9ec: [icmp6 sum ok] ICMP6, neighbor solicitation, length 24, who has fd62:cf7d:2671::9a0c:82ff:fe85:d9ec
13:08:28.780748 IP6 (hlim 1, next-header Options (0) payload length: 36) fe80::9a0c:82ff:fe85:d9ec > ff02::16: HBH (rtalert: 0x0000) (padn) [icmp6 sum ok] ICMP6, multicast listener report v2, 1 group record(s) [gaddr ff02::1:ffc4:8dff to_ex, 0 source(s)]
13:08:36.472786 IP6 (hlim 1, next-header Options (0) payload length: 36) fe80::9a0c:82ff:fe85:d9ec > ff02::16: HBH (rtalert: 0x0000) (padn) [icmp6 sum ok] ICMP6, multicast listener report v2, 1 group record(s) [gaddr ff02::1:ffc4:8dff to_in, 0 source(s)]
13:11:36.324600 IP (tos 0x0, ttl 1, id 5719, offset 0, flags [none], proto UDP (17), length 68)
    192.168.1.100.56218 > 224.0.0.253.3544: UDP, length 40

**Comment by andyVSR** [comment]
and the same log for 2.4ghz (but this time the phone choose to connect) :

root@OpenWrt:/#  tcpdump -i wlan1 -v
tcpdump: listening on wlan1, link-type EN10MB (Ethernet), capture size 262144 bytes
13:20:00.091603 98:0c:82:85:d9:ec (oui Unknown) > Broadcast Null Unnumbered, xid, Flags [Response], length 6: 01 00
13:20:00.092381 98:0c:82:85:d9:ec (oui Unknown) > Broadcast Null Unnumbered, xid, Flags [Response], length 6: 01 00
13:20:00.385952 IP6 (hlim 255, next-header ICMPv6 (58) payload length: 16) fe80::9a0c:82ff:fe85:d9ec > ip6-allrouters: [icmp6 sum ok] ICMP6, router solicitation, length 16
          source link-address option (1), length 8 (1): 98:0c:82:85:d9:ec
13:20:00.386715 IP6 (hlim 255, next-header ICMPv6 (58) payload length: 16) fe80::9a0c:82ff:fe85:d9ec > ip6-allrouters: [icmp6 sum ok] ICMP6, router solicitation, length 16
          source link-address option (1), length 8 (1): 98:0c:82:85:d9:ec
13:20:00.387910 IP6 (flowlabel 0xb038a, hlim 255, next-header ICMPv6 (58) payload length: 120) fe80::6038:e0ff:feb8:e250 > fe80::9a0c:82ff:fe85:d9ec: [icmp6 sum ok] ICMP6, router advertisement, length 120
        hop limit 64, Flags [managed, other stateful], pref medium, router lifetime 0s, reachable time 0s, retrans time 0s
          source link-address option (1), length 8 (1): 62:38:e0:b8:e2:50
          mtu option (5), length 8 (1):  1500
          prefix info option (3), length 32 (4): fd62:cf7d:2671::/64, Flags [onlink, auto], valid time infinity, pref. time infinity
          route info option (24), length 24 (3):  fd62:cf7d:2671::/48, pref=medium, lifetime=infinity
          rdnss option (25), length 24 (3):  lifetime 6000s, addr: OpenWrt.lan
          advertisement interval option (7), length 8 (1):  600000ms
13:20:00.399993 IP6 (hlim 1, next-header Options (0) payload length: 56) fe80::9a0c:82ff:fe85:d9ec > ff02::16: HBH (rtalert: 0x0000) (padn) [icmp6 sum ok] ICMP6, multicast listener report v2, 2 group record(s) [gaddr ff02::1:ffcb:aaa7 to_ex, 0 source(s)] [gaddr ff02::1:ff85:d9ec to_ex, 0 source(s)]
13:20:00.400756 IP6 (hlim 1, next-header Options (0) payload length: 56) fe80::9a0c:82ff:fe85:d9ec > ff02::16: HBH (rtalert: 0x0000) (padn) [icmp6 sum ok] ICMP6, multicast listener report v2, 2 group record(s) [gaddr ff02::1:ffcb:aaa7 to_ex, 0 source(s)] [gaddr ff02::1:ff85:d9ec to_ex, 0 source(s)]
13:20:00.450121 IP (tos 0x0, ttl 64, id 12473, offset 0, flags [none], proto UDP (17), length 343)
    0.0.0.0.68 > 255.255.255.255.67: BOOTP/DHCP, Request from 98:0c:82:85:d9:ec (oui Unknown), length 315, xid 0x3a675ef1, Flags [none]
          Client-Ethernet-Address 98:0c:82:85:d9:ec (oui Unknown)
          Vendor-rfc1048 Extensions
            Magic Cookie 0x63825363
            DHCP-Message Option 53, length 1: Request
            Client-ID Option 61, length 7: ether 98:0c:82:85:d9:ec
            Requested-IP Option 50, length 4: android-8f37aef02265dbcb.lan
            MSZ Option 57, length 2: 1500
            Vendor-Class Option 60, length 13: "dhcpcd-5.2.10"
            Hostname Option 12, length 24: "android-8f37aef02265dbcb"
            Parameter-Request Option 55, length 9:
              Subnet-Mask, Static-Route, Default-Gateway, Domain-Name-Server
              Domain-Name, BR, Lease-Time, RN
              RB
13:20:00.450878 IP (tos 0x0, ttl 64, id 12473, offset 0, flags [none], proto UDP (17), length 343)
    0.0.0.0.68 > 255.255.255.255.67: BOOTP/DHCP, Request from 98:0c:82:85:d9:ec (oui Unknown), length 315, xid 0x3a675ef1, Flags [none]
          Client-Ethernet-Address 98:0c:82:85:d9:ec (oui Unknown)
          Vendor-rfc1048 Extensions
            Magic Cookie 0x63825363
            DHCP-Message Option 53, length 1: Request
            Client-ID Option 61, length 7: ether 98:0c:82:85:d9:ec
            Requested-IP Option 50, length 4: android-8f37aef02265dbcb.lan
            MSZ Option 57, length 2: 1500
            Vendor-Class Option 60, length 13: "dhcpcd-5.2.10"
            Hostname Option 12, length 24: "android-8f37aef02265dbcb"
            Parameter-Request Option 55, length 9:
              Subnet-Mask, Static-Route, Default-Gateway, Domain-Name-Server
              Domain-Name, BR, Lease-Time, RN
              RB
13:20:00.451945 IP (tos 0xc0, ttl 64, id 35552, offset 0, flags [none], proto UDP (17), length 328)
    OpenWrt.lan.67 > android-8f37aef02265dbcb.lan.68: BOOTP/DHCP, Reply, length 300, xid 0x3a675ef1, Flags [none]
          Your-IP android-8f37aef02265dbcb.lan
          Server-IP OpenWrt.lan
          Client-Ethernet-Address 98:0c:82:85:d9:ec (oui Unknown)
          Vendor-rfc1048 Extensions
            Magic Cookie 0x63825363
            DHCP-Message Option 53, length 1: ACK
            Server-ID Option 54, length 4: OpenWrt.lan
            Lease-Time Option 51, length 4: 43200
            RN Option 58, length 4: 21600
            RB Option 59, length 4: 37800
            Subnet-Mask Option 1, length 4: 255.255.255.0
            BR Option 28, length 4: 192.168.1.255
            Default-Gateway Option 3, length 4: OpenWrt.lan
            Domain-Name-Server Option 6, length 4: OpenWrt.lan
            Domain-Name Option 15, length 3: "lan"
13:20:00.833884 IP6 (hlim 255, next-header ICMPv6 (58) payload length: 24) :: > ff02::1:ff85:d9ec: [icmp6 sum ok] ICMP6, neighbor solicitation, length 24, who has fd62:cf7d:2671::9a0c:82ff:fe85:d9ec
13:20:00.834643 IP6 (hlim 255, next-header ICMPv6 (58) payload length: 24) :: > ff02::1:ff85:d9ec: [icmp6 sum ok] ICMP6, neighbor solicitation, length 24, who has fd62:cf7d:2671::9a0c:82ff:fe85:d9ec
13:20:05.462587 IP6 (hlim 255, next-header ICMPv6 (58) payload length: 32) fe80::6038:e0ff:feb8:e250 > fe80::9a0c:82ff:fe85:d9ec: [icmp6 sum ok] ICMP6, neighbor solicitation, length 32, who has fe80::9a0c:82ff:fe85:d9ec
          source link-address option (1), length 8 (1): 62:38:e0:b8:e2:50
13:20:05.584199 IP6 (hlim 255, next-header ICMPv6 (58) payload length: 24) fe80::9a0c:82ff:fe85:d9ec > fe80::6038:e0ff:feb8:e250: [icmp6 sum ok] ICMP6, neighbor advertisement, length 24, tgt is fe80::9a0c:82ff:fe85:d9ec, Flags [solicited]
13:20:10.590795 IP6 (hlim 255, next-header ICMPv6 (58) payload length: 32) fe80::9a0c:82ff:fe85:d9ec > fe80::6038:e0ff:feb8:e250: [icmp6 sum ok] ICMP6, neighbor solicitation, length 32, who has fe80::6038:e0ff:feb8:e250
          source link-address option (1), length 8 (1): 98:0c:82:85:d9:ec
13:20:10.591733 IP6 (hlim 255, next-header ICMPv6 (58) payload length: 24) fe80::6038:e0ff:feb8:e250 > fe80::9a0c:82ff:fe85:d9ec: [icmp6 sum ok] ICMP6, neighbor advertisement, length 24, tgt is fe80::6038:e0ff:feb8:e250, Flags [router, solicited]
13:20:15.023914 IP (tos 0x0, ttl 51, id 7253, offset 0, flags [DF], proto TCP (6), length 40)
    103.232.215.130.80 > android-8f37aef02265dbcb.lan.44805: Flags [F.], cksum 0x1de9 (correct), seq 3637536552, ack 1684683833, win 35, length 0
13:20:15.763928 IP (tos 0x0, ttl 51, id 7254, offset 0, flags [DF], proto TCP (6), length 40)
    103.232.215.130.80 > android-8f37aef02265dbcb.lan.44805: Flags [F.], cksum 0x1de9 (correct), seq 0, ack 1, win 35, length 0
13:20:17.245863 IP (tos 0x0, ttl 51, id 7255, offset 0, flags [DF], proto TCP (6), length 40)
    103.232.215.130.80 > android-8f37aef02265dbcb.lan.44805: Flags [F.], cksum 0x1de9 (correct), seq 0, ack 1, win 35, length 0

**Comment by Keltere** [comment]
@yuhhaurlin ok there is no problem with the throughput, just android phone not connecting. For a 3x3 capability we need to wait MU-MIMO support?

**Comment by yuhhaurlin** [comment]
MU-MIMO has not thing to do with 3x3. The router can support 3x3. Macbook Pro is 3x3, Macbook Air is 2x2. The throupuht for Macbook Pro is better than Macbook Air.

**Comment by andyVSR** [comment]
@yuhhaurlin : is it the android phone or the mwlwifi that makes connects differently for 2.4ghz vs 5ghz ? as i said before, for 2.4ghz i have no issues.

**Comment by eduperez** [comment]
I too had some issues with my Android phone, reported at #267; surprisingly (there was no announcement about this in the release), those issues where resolved with firmware 9.3.2.5 . I am mentioning this because perhaps the new firmware has some impact on the issue being mentioned here.

**Comment by yuhhaurlin** [comment]
Yes, you can test it. But I think 9.3.2.5 is the same as 9.3.2.4 if you use 80 MHz. I wonder if you can check if BF setting resolve your problem?

**Comment by thagabe** [comment]
Pixel 2 XL with Stock OREO 8.1 connects then after 5-10 minutes will disconnect until it re-associates on my WRT1900ACv1 with the 20180226 version. It's been happening for a while now. Using trunk OpenWRT kernel 4.14 with the kernel patch.

**Comment by eduperez** [comment]
@thagabe Ha you tried disabling group re-keying?

**Comment by yuhhaurlin** [comment]
I will check this one later. Thanks.

**Comment by bg4drl** [comment]
Google home max don't work.

**Comment by myoriginalusername** [comment]
I'm running a WRT1900ACS and occasionally having Android devices dropping out too.  The only way to fix it is with a reboot of the router. 

Interestingly enough, the list of devices it's affecting is varied: everything ranging from a Xiaomi device to Samsung Galaxy S7 amongst others. Meanwhile, there's a Motorola device in our household which isn't affected (amongst others).

The random nature of the issue means it's hard for me reproduce the problem but I'd greatly appreciate anyone's input on the matter.

**Comment by danny30au** [comment]
@yuhhaurlin This problem has been going on for YEARS and STILL not fixed, I sold my WRT1900AC V2 and brought a TP-LINK 2600 (Qualcomm Atheros) and loaded OpenWRT on to it and guess what? My Motorola Z2 play connected straightway to the 5Ghz band. Release a proper source code mate and stop playing games. Clearly your the only bloke working on this (source code) having a closed source code and open source code is WRONG in my eyes this misleading.

**Comment by dannil** [comment]
Same issue here, Samsung S5 refuses to stay connected even when mobile data is disabled. Disabling group rekeying has no effect.

**Comment by hemzer** [comment]
> Small update. This only happens on 5GHz network. On 2.4GHz network clients connect normally and receive "Connected" status right after connection.

occurs for me on 2.4 Ghz.   I have perfect android connection on 5Ghz.
OpenWrt  22.03.2 / Google nexus Nexus 5x  android 8.1.0
